CLEARSIGN COMBUSTION CORP,https://www.nasdaq.com/markets/ipos/company/clearsign-combustion-corp-777788-68613,https://www.nasdaq.com/markets/ipos/company/clearsign-combustion-corp-777788-68613,424B3,5/1/2012,https://www.nasdaq.com/markets/ipos/filing.ashx?filingid=8581636,"Based on an assumed offering price of $4.00 per share, we estimate the gross 
proceeds from the sale of 3,000,000 shares of common stock, prior to deducting 
underwriting discounts and commissions and the estimated offering expenses 
payable by us, will be $12.0 million ($13.8 million if the over-allotment 
option granted to the underwriter is exercised in full). 

We estimate that we will receive net proceeds of approximately $9.5 million, 
after deducting underwriting discounts and commissions and our underwriter’s 
expense allowance, the fees of the qualified independent underwriter, and 
other estimated expenses of approximately $1.2 million, which includes legal, 
accounting, printing costs and various fees associated with the registration 
and listing of our shares. If the underwriter exercises its right to purchase 
an additional 450,000 shares of common stock to cover over-allotments, we will 
receive an additional approximate $1.64 million, after deducting approximately 
$0.16 million for underwriting discounts and commissions.  

We currently intend to use the net proceeds of this offering as follows: 
approximately $5 million for research and development including capital 
expenditures, $1 million for protection of intellectual property, $1.25 
million for exploration of marketing opportunities, and the balance for 
working capital and general corporate purposes. 

The amounts and timing of our actual expenditures will depend on numerous 
factors, including market conditions, results from our research and 
development efforts, business developments and opportunities and related 
rate of growth, sales and marketing activities and competition. Accordingly, 
our management will have broad discretion in the application of the net 
proceeds, and investors will be relying on the judgment of our management 
regarding the application of the proceeds from this offering. We may find 
it necessary or advisable to use portions of the proceeds from this offering 
for other purposes. Circumstances that may give rise to a change in the use 
of proceeds and the alternate purposes for which the proceeds may be used 
include:  

 •  the existence of unforeseen or other opportunities or the need to take 
    advantage of changes in timing of our existing activities;   

 •  the need or desire on our part to accelerate, increase, reduce or eliminate
    one or more existing initiatives due to, among other things, changing 
    market conditions and competitive developments or interim results of 
    research and development efforts;   

 •  results from our business development and marketing efforts, including co-
    development and pilot site installation opportunities that may materialize;

 •  the effect of federal, state, and local regulation, including those 
    governing emissions, of potential customers in our identified industries;  

 •  our ability to attract development funding or to license or sell our 
    technology to industry sponsors or other interested organizations; and/or  

 •  strategic opportunities of which we are not currently aware present 
    themselves (including acquisitions, joint ventures, licensing and other 
    similar transactions).   

From time to time, we evaluate these and other factors and we anticipate 
continuing to make such evaluations to determine if the existing allocation of 
resources, including the proceeds of this offering, is being optimized."
CLEARSIGN COMBUSTION CORP,https://www.nasdaq.com/markets/ipos/company/clearsign-combustion-corp-777788-68613,https://www.nasdaq.com/markets/ipos/company/clearsign-combustion-corp-777788-68613,424B1,4/25/2012,https://www.nasdaq.com/markets/ipos/filing.ashx?filingid=8561007,"Based on an assumed offering price of $4.00 per share, we estimate the gross 
proceeds from the sale of 3,000,000 shares of common stock, prior to deducting 
underwriting discounts and commissions and the estimated offering expenses 
payable by us, will be $12.0 million ($13.8 million if the over-allotment 
option granted to the underwriter is exercised in full). 

We estimate that we will receive net proceeds of approximately $9.5 million, 
after deducting underwriting discounts and commissions and our underwriter’s 
expense allowance, the fees of the qualified independent underwriter, and 
other estimated expenses of approximately $1.2 million, which includes legal, 
accounting, printing costs and various fees associated with the registration 
and listing of our shares. If the underwriter exercises its right to purchase 
an additional 450,000 shares of common stock to cover over-allotments, we will 
receive an additional approximate $1.64 million, after deducting approximately 
$0.16 million for underwriting discounts and commissions.  

We currently intend to use the net proceeds of this offering as follows: 
approximately $5 million for research and development including capital 
expenditures, $1 million for protection of intellectual property, $1.25 
million for exploration of marketing opportunities, and the balance for 
working capital and general corporate purposes. 

The amounts and timing of our actual expenditures will depend on numerous 
factors, including market conditions, results from our research and 
development efforts, business developments and opportunities and related 
rate of growth, sales and marketing activities and competition. Accordingly, 
our management will have broad discretion in the application of the net 
proceeds, and investors will be relying on the judgment of our management 
regarding the application of the proceeds from this offering. We may find 
it necessary or advisable to use portions of the proceeds from this offering 
for other purposes. Circumstances that may give rise to a change in the use 
of proceeds and the alternate purposes for which the proceeds may be used 
include:  

 •  the existence of unforeseen or other opportunities or the need to take 
    advantage of changes in timing of our existing activities;   

 •  the need or desire on our part to accelerate, increase, reduce or eliminate
    one or more existing initiatives due to, among other things, changing 
    market conditions and competitive developments or interim results of 
    research and development efforts;   

 •  results from our business development and marketing efforts, including co-
    development and pilot site installation opportunities that may materialize;

 •  the effect of federal, state, and local regulation, including those 
    governing emissions, of potential customers in our identified industries;  

 •  our ability to attract development funding or to license or sell our 
    technology to industry sponsors or other interested organizations; and/or  

 •  strategic opportunities of which we are not currently aware present 
    themselves (including acquisitions, joint ventures, licensing and other 
    similar transactions).   

From time to time, we evaluate these and other factors and we anticipate 
continuing to make such evaluations to determine if the existing allocation of 
resources, including the proceeds of this offering, is being optimized."
INFOBLOX INC,https://www.nasdaq.com/markets/ipos/company/infoblox-inc-401158-68992,https://www.nasdaq.com/markets/ipos/company/infoblox-inc-401158-68992,424B4,4/20/2012,https://www.nasdaq.com/markets/ipos/filing.ashx?filingid=8555655,"We estimate that the net proceeds from the sale of shares of our common stock 
that we are selling in this offering will be approximately $81.3 million, 
based on the initial public offering price of $16.00 per share, and after 
deducting underwriting discounts and commissions and estimated offering 
expenses payable by us. If the underwriters’ option to purchase additional 
shares in this offering is exercised in full, we estimate that our net 
proceeds would be approximately $98.0 million, after deducting underwriting 
discounts and commissions and estimated offering expenses payable by us. We 
will not receive any proceeds from the sale of shares of our common stock by 
the selling stockholders. 

The principal purposes of this offering are to obtain additional capital, to 
create a public market for our common stock and to facilitate our future 
access to the public equity markets. We expect to use the net proceeds that 
we receive from this offering for working capital and other general corporate 
purposes. We may also use a portion of the net proceeds that we receive from 
this offering for investments in or acquisitions of complementary businesses, 
products, services, technologies or other assets. We have not entered into 
any agreements or commitments with respect to any investments or acquisitions 
at this time. 

We currently have no specific plans for the use of the net proceeds that we 
receive from this offering. Accordingly, we will have broad discretion in 
using these proceeds. Pending the use of proceeds from this offering as
described above, we plan to invest the net proceeds in short-term, 
interest-bearing obligations, investment-grade instruments, certificates 
of deposit or direct or guaranteed obligations of the U.S. government."
"GREEN BALLAST, INC.",https://www.nasdaq.com/markets/ipos/company/green-ballast-inc-860951-68462,https://www.nasdaq.com/markets/ipos/company/green-ballast-inc-860951-68462,424B3,11/19/2012,https://www.nasdaq.com/markets/ipos/filing.ashx?filingid=8925458,"Each of the selling stockholders will receive all of the net proceeds from the 
sale of common stock held by that stockholder. We will not receive any proceeds
from the sales of our common stock by the selling stockholders. However, we 
will receive up to $2,250,000 in the aggregate from the cash exercise of the 
warrants. We intend to use the proceeds received from the cash exercise of the 
warrants for working capital and general corporate purposes."
"GREEN BALLAST, INC.",https://www.nasdaq.com/markets/ipos/company/green-ballast-inc-860951-68462,https://www.nasdaq.com/markets/ipos/company/green-ballast-inc-860951-68462,424B3,8/20/2012,https://www.nasdaq.com/markets/ipos/filing.ashx?filingid=8783351,"Each of the selling stockholders will receive all of the net proceeds from the 
sale of common stock held by that stockholder. We will not receive any proceeds
from the sales of our common stock by the selling stockholders. However, we 
will receive up to $2,250,000 in the aggregate from the cash exercise of the 
warrants. We intend to use the proceeds received from the cash exercise of the 
warrants for working capital and general corporate purposes."
"GREEN BALLAST, INC.",https://www.nasdaq.com/markets/ipos/company/green-ballast-inc-860951-68462,https://www.nasdaq.com/markets/ipos/company/green-ballast-inc-860951-68462,424B3,6/4/2012,https://www.nasdaq.com/markets/ipos/filing.ashx?filingid=8655288,"Each of the selling stockholders will receive all of the net proceeds from the 
sale of common stock held by that stockholder. We will not receive any proceeds
from the sales of our common stock by the selling stockholders. However, we 
will receive up to $2,250,000 in the aggregate from the cash exercise of the 
warrants. We intend to use the proceeds received from the cash exercise of the 
warrants for working capital and general corporate purposes."
"GREEN BALLAST, INC.",https://www.nasdaq.com/markets/ipos/company/green-ballast-inc-860951-68462,https://www.nasdaq.com/markets/ipos/company/green-ballast-inc-860951-68462,424B3,4/19/2012,https://www.nasdaq.com/markets/ipos/filing.ashx?filingid=8552599,"Each of the selling stockholders will receive all of the net proceeds from the 
sale of common stock held by that stockholder. We will not receive any proceeds
from the sales of our common stock by the selling stockholders. However, we 
will receive up to $2,250,000 in the aggregate from the cash exercise of the 
warrants. We intend to use the proceeds received from the cash exercise of the 
warrants for working capital and general corporate purposes."
"MIDSTATES PETROLEUM COMPANY, INC.",https://www.nasdaq.com/markets/ipos/company/midstates-petroleum-company-inc-867950-68626,https://www.nasdaq.com/markets/ipos/company/midstates-petroleum-company-inc-867950-68626,424B4,4/20/2012,https://www.nasdaq.com/markets/ipos/filing.ashx?filingid=8555186,"We expect to receive approximately $215.6 million of net proceeds from the 
sale of the common stock offered by us, based upon the initial public
offering price of $13.00 per share, after deducting underwriting discounts 
and commissions and estimated offering expenses payable by us. 

We intend to use the net proceeds from this offering to redeem preferred 
units that were previously issued by Midstates Petroleum Holdings LLC to an 
affiliate of First Reserve and to repay a portion of our outstanding 
indebtedness under our revolving credit facility. 

We intend to use the following amounts for the above uses: 

Use of Proceeds                                                Amount   
  
Redeem preferred units, including interest and other 
charges, which were previously issued by Midstates 
Petroleum Holdings LLC to an affiliate of First Reserve        $  67.1      
Repayment of a portion of revolving credit facility              148.5      
       
Total                                                         $  215.6

Our revolving credit facility matures in December 2014 and bears interest 
at a variable rate, which was approximately 3.2% per annum as of December 
31, 2011. Our outstanding borrowings under our revolving credit facility 
were incurred to fund exploration, development and other capital expenditures. 
While we do not currently have any plans to immediately borrow additional 
amounts under the revolving credit facility, we may at any time reborrow 
amounts repaid under the revolving credit facility and expect to do so to 
fund a portion of our exploration and development program. 

The preferred units issued by Midstates Petroleum Holdings LLC to an 
affiliate of First Reserve bear interest, payable upon redemption, at a 
variable rate, which was approximately 9.5% per annum as of April 18, 2012. 
In addition, a fixed interest charge of 1.5% of the aggregate amount of 
capital contributions made with respect to the preferred units is payable 
upon redemption. Proceeds from the issuance of the preferred units were used 
to fund exploration, development and other capital expenditures. In connection 
with the completion of our corporate reorganization, Midstates Petroleum 
Holdings LLC will no longer exist as a separate entity and therefore no 
additional preferred units will be available for issuance. 

We will not receive any of the proceeds from the sale of shares of our common 
stock by the selling stockholders. We will pay all expenses related to this 
offering, other than underwriting discounts and commissions related to the 
shares sold by the selling stockholders. 

Affiliates of certain of the underwriters are lenders under our revolving 
credit facility and, as a result, may receive more than 5% of the net 
proceeds from this offering."
PROOFPOINT INC,https://www.nasdaq.com/markets/ipos/company/proofpoint-inc-389844-68813,https://www.nasdaq.com/markets/ipos/company/proofpoint-inc-389844-68813,424B4,4/20/2012,https://www.nasdaq.com/markets/ipos/filing.ashx?filingid=8553921,"We estimate that the net proceeds from the sale of shares of our common stock 
that we are selling in this offering will be approximately $59.8 million, based
on the initial public offering price of $13.00 per share and after deducting 
underwriting discounts and commissions and estimated offering expenses payable 
by us. If the underwriters' option to purchase additional shares from us and 
the selling stockholders is exercised in full, we estimate that we will receive
additional net proceeds of $9.3 million. We will not receive any proceeds from 
the sale of shares of our common stock by the selling stockholders. 

The principal purposes of this offering are to increase our financial 
flexibility, improve our visibility in the marketplace and create a public 
market for our common stock. We expect to use the net proceeds that we receive 
from this offering for working capital and other general corporate purposes. 
While we have no specific plans at this time, we may use some of the proceeds 
from this offering to fund the expansion of our domestic and international data
center infrastructure or to pay down a portion of our outstanding balances 
under our equipment loans. As of December 31, 2011, we had $4.9 million 
outstanding under our equipment loans. In addition, as of December 31, 2011, we
had contractual obligations related to capital and operating lease obligations 
and purchase obligations over the next three years of approximately $5.6 
million. The amount of proceeds we use for these purposes, if any, will depend 
on the level of cash generated from operations. We may also use a portion of 
the net proceeds that we receive from this offering for investments in or 
acquisitions of complementary businesses, products, services, technologies or 
other assets. 

Except as set forth above, we currently have no specific plans for the use of 
the net proceeds that we receive from this offering. Accordingly, we will have 
broad discretion in using the net proceeds that we receive from this offering. 
Pending the use of proceeds from this offering as described above, we plan to 
invest the net proceeds in short-term, interest-bearing obligations, 
investment-grade instruments, certificates of deposit or direct or guaranteed 
obligations of the U.S. government."
SPLUNK INC,https://www.nasdaq.com/markets/ipos/company/splunk-inc-699512-69023,https://www.nasdaq.com/markets/ipos/company/splunk-inc-699512-69023,424B4,4/20/2012,https://www.nasdaq.com/markets/ipos/filing.ashx?filingid=8553917,"We estimate that the net proceeds from our sale of 12,507,278 shares of common 
stock in this offering at the initial public offering price of $17.00 per 
share, after deducting underwriting discounts and commissions and estimated 
offering expenses payable by us, will be approximately $193.8 million, or 
$225.8 million if the underwriters' over-allotment option is exercised in full.
We will not receive any proceeds from the sale of common stock by the selling 
stockholders. 

The principal purposes of this offering are to increase our capitalization and 
financial flexibility, increase our visibility in the marketplace and create a 
public market for our common stock. As of the date of this prospectus, we have 
no specific plans for the use of the net proceeds we receive from this 
offering. However, we currently intend to use the net proceeds we receive from 
this offering primarily for general corporate purposes, including working 
capital, sales and marketing activities, product development, general and 
administrative matters, and capital expenditures. We may also use a portion of 
the net proceeds for the acquisition of, or investment in, technologies, 
solutions or businesses that complement our business, although we have no 
present commitments or agreements to make any acquisitions or investments. We 
will have broad discretion over the uses of the net proceeds in this offering. 
Pending these uses, we intend to invest the net proceeds from this offering in 
short-term, investment-grade interest-bearing securities such as money market 
accounts, certificates of deposit, commercial paper and guaranteed obligations 
of the U.S. government."
"TUMI HOLDINGS, INC.",https://www.nasdaq.com/markets/ipos/company/tumi-holdings-inc-869627-68806,https://www.nasdaq.com/markets/ipos/company/tumi-holdings-inc-869627-68806,424B4,4/20/2012,https://www.nasdaq.com/markets/ipos/filing.ashx?filingid=8555434,"The net proceeds to us from the sale of common stock by us in this offering 
will be $264.1 million, after deducting underwriting discounts and 
commissions. 

We intend to apply the net proceeds we receive from this offering to the 
following uses: 

. approximately $157.7 million to repurchase all of our outstanding shares 
of Series A preferred stock (at their liquidation preference plus accrued 
and unpaid dividends); 
 
. approximately $101.7 million to repurchase all of the new class of our 
preferred stock issued in the Reorganization (at their liquidation preference 
plus accrued and unpaid dividends); and 

. $4.7 million to repurchase shares of our common stock held by the LLC’s 
preferred interests holders and Series A preferred stockholders, which consist 
of only Doughty Hanson (at the initial public offering price per share, net of 
underwriting discounts and commissions). 

Doughty Hanson holds all of our outstanding Series A preferred stock, will 
hold the new class of our preferred stock issued in the Reorganization and 
holds all common stock to be repurchased by us in the Common Stock Repurchase. 
Doughty Hanson, accordingly, will receive all the net proceeds to us from this 
offering. 

We intend to use cash on hand to pay $4.8 million of estimated offering 
expenses payable by us (less $0.1 million in offering expenses that have 
already been paid as of December 31, 2011) and $5.5 million of the cash 
bonus due to Jerome Griffith, our Chief Executive Officer, President and 
Director, upon the consummation of this offering. 

We will not receive any proceeds from the sale of shares of common stock 
by the selling stockholders."
DIGITAL CINEMA DESTINATIONS CORP.,https://www.nasdaq.com/markets/ipos/company/digital-cinema-destinations-corp-845674-68863,https://www.nasdaq.com/markets/ipos/company/digital-cinema-destinations-corp-845674-68863,424B4,4/18/2012,https://www.nasdaq.com/markets/ipos/filing.ashx?filingid=8551267,"We estimate that we will receive net proceeds from this offering of 
approximately $ 11.4 million, after deducting underwriting discounts and 
commissions and other estimated offering expenses (approximately $400,000 of 
which have already been paid) payable by us related to this offering. We intend
to use $11.0 million of the net proceeds from this offering to fund the cash 
portion of the Cinema Centers purchase price and $1.1 million of the net 
proceeds to repay an outstanding obligation owed by us to Barco for purchases 
of digital cinema projector equipment, which obligation is not interest bearing
and has no specific maturity date. To the extent the proceeds from this 
offering are not sufficient for the uses described above, we intend to use cash
on hand to fund any such difference. To the extent the net proceeds from this 
offering exceed the uses described above, w e intend to use the balance of the 
net proceeds from this offering for general corporate purposes, including our
working capital needs. If we fail to consummate the Cinema Centers acquisition,
we plan to use the portion of the net proceeds from this offering not used for 
the acquisition for future acquisitions and general corporate purposes, 
including working capital needs. 

The foregoing represents our intentions as to the use and allocation of the net
proceeds of this offering based upon our present plans, contractual obligations
and business conditions. The amount and timing of any expenditure will vary 
depending on the amount of cash generated by our operations and the rate of 
growth, if any, of our business. Accordingly, our management will have 
significant discretion in the allocation of the net proceeds we will receive 
from this offering. Depending on future events and other changes in the 
business climate, we may determine at a later time to use the net proceeds for 
different purposes. Pending their use, we intend to invest the proceeds in a 
variety of capital preservation instruments, including short-term, investment-
grade, and interest-bearing instruments."
