COLLABRIUM JAPAN ACQUISITION CORP,https://www.nasdaq.com/markets/ipos/company/collabrium-japan-acquisition-corp-889090-70716,https://www.nasdaq.com/markets/ipos/company/collabrium-japan-acquisition-corp-889090-70716,424B4,10/23/2012,https://www.nasdaq.com/markets/ipos/filing.ashx?filingid=8874197,"We are offering 4,000,000 units at an offering price of $10.00 per unit. We 
estimate that the net proceeds of this offering together with the funds we 
will receive from the sale of the insider warrants will be used as set forth 
in the following table. 

                                                      Without        Over-
                                                      Over-          Allotment
                                                      Allotment      Option 
                                                      Option         Exercised 

Gross proceeds 
                                                  
Gross proceeds from units offered to public       $  40,000,000   $  46,000,000
Gross proceeds from insider warrants offered 
in the private placement                              2,700,000       2,700,000
Total gross proceeds                              $  42,700,000   $  48,700,000
Estimated Offering expenses (1) 
                                                  
Underwriting commissions (1.5% of gross 
proceeds from units offered to public, excluding 
deferred corporate finance fee) (2)               $     600,000   $     690,000
Legal fees and expenses                                 230,000         230,000
Printing and engraving expenses                          40,000          40,000
Accounting fees and expenses                             40,000          40,000
NASDAQ Capital Market Listing fees                       50,000          50,000
SEC filing fees                                           5,959           5,959
FINRA Registration fee                                    8,300           8,300
Miscellaneous                                            25,741          25,741
Total offering expenses                           $   1,000,000   $   1,090,000
Proceeds after offering expenses                  $  41,700,000   $  47,610,000
Not held in trust account                         $     300,000   $     300,000
Held in trust account                             $  41,400,000   $  47,310,000
% of public offering size                              103.5  %        102.8  %

The following table shows the use of the $300,000 of net proceeds not held in 
the trust account and an additional $75,000 (based on current estimated 
yields) of interest earned on our trust account (net of taxes payable) that 
may be available to us to cover operating expenses, for a total of $375,000.

                                                         Amount(3)  Percentage

Legal, accounting, due diligence, travel,            
and other expenses in connection with any              $  107,500    28.7%     
business combination                                           
Legal and accounting fees related to                       40,000    10.7%   
regulatory reporting obligations  
Administrative Fee                                        135,000   3 6.0% 
Director and Officer Insurance                             85,000    22.7% 
Other miscellaneous expenses                                7,500     1.9% 
Total                                                     375,000   100.0% 

(1) A portion of the offering expenses have been prepaid from the proceeds of 
    an aggregate of $100,000 of loans from our management team, as described 
    in this prospectus. The loans will be repaid without interest upon the 
    closing of this offering out of the amount of offering proceeds that has 
    been allocated for the payment of offering expenses other than 
    underwriting commissions. 

(2) The underwriting discount of 1.5% is payable at the closing of the 
    offering and the deferred corporate finance fee of 3.0% payable to The 
    PrinceRidge Group LLC is payable upon consummation of our initial business 
    combination and will be held in the trust account until consummation of 
    such business combination. No discounts or commissions will be paid with 
    respect to the purchase of the insider warrants. 

(3) These are estimates only. Our actual expenditures for some or all of these 
    items may differ from the estimates set forth herein. For example, we may 
    incur greater legal and accounting expenses than our current estimates in 
    connection with negotiating and structuring our initial business 
    combination based upon the level of complexity of that business 
    combination. We do not anticipate any change in our intended use of 
    proceeds, other than fluctuations among the current categories of 
    allocated expenses, which fluctuations, to the extent they exceed current 
    estimates for any specific category of expenses, would be deducted from 
    our excess working capital. 

A total of $41,400,000 ($47,310,000 if the underwriter’s over-allotment option 
is exercised in full) of the net proceeds from this offering and the sale of 
the insider warrants described in this prospectus, including $1,200,000 
($1,380,000 if the underwriter’s over-allotment option is exercised in full) 
deferred corporate finance fee payable to The PrinceRidge Group LLC, will be 
placed in a trust account with Continental Stock Transfer & Trust Company 
acting as trustee and will be invested only in U.S. government treasury bills 
with a maturity of 180 days or less or in registered money market funds 
meeting certain conditions under Rule 2a-7 under the Investment Company Act 
and that invest solely in U.S. Treasuries. Except for the interest income that
may be released to us to pay any taxes and to fund our working capital 
requirements, as discussed below, none of the funds held in trust will be 
released from the trust account until the earlier of: (i) the consummation of 
our initial business combination within 15 months from the closing of this 
offering (or 18 months if we take advantage of the full 90-day extension), 
(ii) the redemption of shares held by public shareholders that seek to redeem 
their shares in connection with us taking advantage of the 90-day extension 
and (iii) our redemption of 100% of the outstanding public shares in the 
event we do not consummate our initial business combination within this time 
period. 

The net proceeds held in the trust account may be used as consideration to 
pay the sellers of a target business with which we ultimately complete our 
initial business combination. If our initial business combination is paid for 
using shares or debt securities, or not all of the funds released from the 
trust account are used for payment of the purchase price in connection with 
our business combination, we may apply the cash released from the trust 
account that is not applied to the purchase price for general corporate 
purposes, including for maintenance or expansion of operations of acquired 
businesses, the payment of principal or interest due on indebtedness incurred 
in consummating our initial business combination, to fund the purchase of 
other companies or for working capital. 

We believe that amounts not held in trust, as well as the interest income that 
may be released to fund our working capital requirements in addition to the 
loans discussed below, will be sufficient to pay the costs and expenses to 
which such proceeds are allocated. This belief is based on the fact that 
while we may begin preliminary due diligence of a target business in 
connection with an indication of interest, we intend to undertake in-depth 
due diligence, depending on the circumstances of the relevant prospective 
acquisition, only after we have negotiated and signed a letter of intent or 
other preliminary agreement that addresses the terms of our initial business 
combination. However, if our estimate of the costs of undertaking in-depth 
due diligence and negotiating our initial business combination is less than 
the actual amount necessary to do so, or the amount of interest available to 
use from the trust account is less than $75,000 as a result of the current 
interest rate environment, we may be required to raise additional capital, 
the amount, availability and cost of which is currently unascertainable. 

In addition, in order to finance transaction costs in connection with an 
intended initial business combination, one or more of our initial 
shareholders, officers, directors or their affiliates may, but are not 
obligated to, loan us funds as may be required. Each loan would be evidenced 
by a promissory note. The notes would either be paid upon consummation of our 
initial business combination, without interest, or, at the holder’s 
discretion, up to $500,000 may be converted into warrants at a price of $0.75 
per warrant. The warrants would be identical to the insider warrants. The 
promissory notes will provide that if we do not complete a business 
combination, the amounts represented by such promissory notes will be 
forgiven. 

The payment to Collabrium Advisors LLP, an affiliate of Andrew Williams, our 
Chairman of the Board, and Eureka Company Limited, an affiliate of Koji Fusa, 
our Chief Executive Officer, of an aggregate monthly fee of $7,500 is for 
general and administrative services including office space, utilities and 
secretarial support. This arrangement is being agreed to by Collabrium 
Advisors LLP and Eureka Company Limited for our benefit and is not intended to 
provide Messrs. Williams or Fusa compensation in lieu of a salary. We believe, 
based on rents and fees for similar services in London and Tokyo, that the 
fee charged by Collabrium Advisors LLP and Eureka Company Limited is at least 
as favorable as we could have obtained from an unaffiliated third party. This 
arrangement will terminate upon completion of our initial business 
combination or the redemption of our public shares if we have not completed 
our initial business combination within the required time period. Other than 
the $7,500 per month fee, no compensation of any kind (including finder’s, 
consulting or other similar fees) will be paid to any of our initial 
shareholders, officers, directors or any of their affiliates prior to, or for 
any services they render in order to effectuate, the consummation of the 
business combination (regardless of the type of transaction that it is). 
However, such individuals will receive reimbursement for any out-of-pocket 
expenses incurred by them in connection with activities on our behalf, such 
as identifying potential target businesses, performing business due diligence 
on suitable target businesses and business combinations as well as traveling 
to and from the offices, plants or similar locations of prospective target 
businesses to examiner their operations. 

As of the date of this prospectus, our management team has loaned and 
advanced to us a total of $100,000 to be used for a portion of the expenses 
of this offering. These advances are non-interest bearing, unsecured and are 
due at the earlier of (i) April 15, 2013, (ii) the closing of this offering 
or (iii) the date on which we determine not to proceed with our initial 
public offering. The loans will be repaid upon the closing of this offering 
out of the amount of offering proceeds that has been allocated to the payment 
of offering expenses. 

If we are no longer an FPI and seek shareholder approval of our initial 
business combination and we do not conduct redemptions in connection with our 
business combination pursuant to the tender offer rules, we may enter into 
privately negotiated transactions to purchase public shares from shareholders 
following our consummation of our initial business combination with proceeds 
released to us from the trust account immediately following consummation of 
our initial business combination. Our initial shareholder, directors, 
officers, advisors or their affiliates may also purchase shares in privately 
negotiated transactions either prior to or following the consummation of our 
initial business combination. Neither we nor our directors, officers, 
advisors or their affiliates will make any such purchases when we or they are 
in possession of any material non-public information not disclosed to the 
seller or during a restricted period under Regulation M under the Exchange 
Act. Although we do not currently anticipate paying any premium purchase 
price (over the trust value) for such public shares, in the event we do, the 
payment of a premium may not be in the best interest of those shareholders 
not receiving any such premium because such shareholders may experience a 
reduction in book value per share compared to the value received by 
shareholders that have their shares purchased by us at a premium. 
Nevertheless, because any payment of a premium by us will be made only from 
proceeds released to us from the trust account following completion of a 
business combination, no such payments will reduce the per share amounts 
available in the trust account for redemption in connection with the business 
combination. There is no limit on the amount of shares that could be acquired 
by us after our initial business combination or by our affiliates prior to or 
after our initial business combination, or the price we or they may pay, if 
we hold a shareholder vote. 

In no event will we redeem our public shares in an amount that would cause 
our net tangible assets to be less than $5,000,001. Furthermore, the 
redemption threshold may be further limited by the terms and conditions of our 
initial business combination. In such case, we would not proceed with the 
redemption of our public shares or the business combination, and instead may 
search for an alternate business combination. 

A public shareholder will be entitled to receive funds from the trust account 
only upon the earlier to occur of: (i) our consummation of an initial business 
combination, and then only in connection with those ordinary shares that such 
shareholder properly elected to redeem, subject to the limitations described 
herein, (ii) the redemption of public shares by holders that seek to have 
their shares redeemed in connection with our taking advantage of the 90-day 
extension or (iii) the redemption of our public shares if we are unable to 
consummate our initial business combination within 15 months following the 
closing of this offering (or 18 months if we have taken advantage of the 
90-day extension), subject to applicable law and as further described herein 
and any limitations (including but not limited to cash requirements) created 
by the terms of the proposed business combination. In no other circumstances 
will a public shareholder have any right or interest of any kind to or in the 
trust account. 

Our initial shareholders, officers and directors have agreed to waive their 
redemption rights with respect to any founder shares and public shares in 
connection with the consummation of our initial business combination. In 
addition, our initial shareholders, officers and directors have agreed to 
waive their right to liquidating distributions with respect to the founder 
shares if we fail to consummate our initial business combination within 15 
months from the closing of this offering (or 18 months if we take advantage 
of the full 90-day extension). However, if our initial shareholders, or any 
of our officers, directors or affiliates acquire public shares in or after 
this offering, they will be entitled to receive liquidating distributions 
with respect to such public shares if we fail to consummate our initial 
business combination within the required time period."
