Name,Overview Url,Use of Proceeds Url,Form,Filing Date,Form Url,Use of Proceeds
"VERASTEM, INC.",https://www.nasdaq.com/markets/ipos/company/verastem-inc-860700-68518,https://www.nasdaq.com/markets/ipos/company/verastem-inc-860700-68518,424B4,1/27/2012,https://www.nasdaq.com/markets/ipos/filing.ashx?filingid=8356281,"We estimate that the net proceeds from our issuance and sale of 5,500,000 
shares of our common stock in this offering will be approximately $49.1 
million, based on the initial public offering price of $10.00 per share, after 
deducting underwriting discounts and commissions and estimated offering 
expenses payable by us. If the underwriters exercise their over-allotment 
option in full, we estimate that the net proceeds from this offering will be 
approximately $56.7 million. 

We currently estimate that we will use the net proceeds from this offering as 
follows: 

–> approximately $4.5 million to $5.0 million to complete preclinical and Phase
   1 clinical development of VS-507; 

–> approximately $5.0 million to $6.0 million to complete preclinical 
   development of VS-4718 and VS-5095 and Phase 1 clinical development of 
   whichever of these two product candidates we select to advance into human 
   clinical trials; 

–> approximately $6.0 million to $7.0 million for preclinical studies of our 
   other proprietary product candidates and companion diagnostics; 

–> approximately $11.0 million to $12.0 million for discovery, research and 
   preclinical studies of additional compounds; and 

–> the balance to fund working capital, capital expenditures and other general 
   corporate purposes, which may include the acquisition or in-license of 
   additional compounds, product candidates or technology. 

This expected use of the net proceeds from this offering represents our 
intentions based upon our current plans and business conditions. The amounts 
and timing of our actual expenditures may vary significantly depending on 
numerous factors, including the progress of our development efforts, the status
of and results from clinical trials, as well as any collaborations that we may 
enter into with third parties for our product candidates, and any unforeseen 
cash needs. As a result, our management will retain broad discretion over the 
allocation of the net proceeds from this offering. We have no current 
understandings, agreements or commitments for any material acquisitions or 
licenses of any compounds, product candidates or technology. 

Based on our planned use of the net proceeds from this offering, we expect that
such funds, together with our existing cash and cash equivalents, will be 
sufficient to enable us to complete preclinical and Phase 1 clinical 
development of VS-507 and either VS-4718 or VS-5095 and, subject to 
successfully completing Phase 1 clinical development, complete a Phase 2 
clinical trial for one of VS-507, VS-4718 or VS-5095. However, it is possible 
that we will not achieve the progress that we expect because the actual costs 
and timing of research and development are difficult to predict, subject to 
substantial risks and delays and often vary depending on the particular 
indication and development strategy. We do not expect that the net proceeds 
from this offering and our existing cash and cash equivalents will be 
sufficient to enable us to fund the completion of development of any of our 
product candidates. 

Pending our use of the net proceeds from this offering, we intend to invest the
net proceeds in a variety of capital preservation investments, including short-
term, investment grade, interest bearing instruments and U.S. government 
securities."
"GUIDEWIRE SOFTWARE, INC.",https://www.nasdaq.com/markets/ipos/company/guidewire-software-inc-863116-68084,https://www.nasdaq.com/markets/ipos/company/guidewire-software-inc-863116-68084,424B4,1/25/2012,https://www.nasdaq.com/markets/ipos/filing.ashx?filingid=8350974,"We estimate that the net proceeds from our sale of 8,850,000 shares of common 
stock in this offering at an initial public offering price of $13.00 per 
share, and after deducting underwriting discounts and commissions and 
estimated offering expenses, will be approximately $103.0 million, or $119.0 
million if the underwriters’ over-allotment option is exercised in full. 

The principal purposes of this offering are to create a public market for our 
common stock and to facilitate our access to public equity markets, as well 
as to obtain additional capital. Except as set forth in this section, we 
have no specific plans as to the use of a specific portion of the proceeds 
of this offering. However, we anticipate that we will use the net proceeds 
of this offering primarily for general corporate purposes, including working 
capital. We also intend to use certain of the net proceeds to satisfy tax 
withholding obligations related to the vesting of RSUs held by current or 
former employees, which will begin to vest 180 days after the completion of
this offering. We do not currently know the amount of net proceeds that will 
be used to satisfy these tax withholding obligations because it will be
dependent on a number of factors, including our stock price on the date of 
vesting and the number of shares underlying RSUs that vest on such date. At 
the initial public offering price of $13.00 per share, 1,210,702 shares 
underlying RSUs vesting on such date and the statutory minimum income tax 
rate for our employees, we would use $5.6 million to satisfy these tax 
withholding obligations. A $1.00 increase (decrease) in the assumed price of
our common stock on the date of vesting would increase (decrease) the amount 
we would be required to pay to satisfy these tax withholding obligations by 
$0.4 million. 

In addition, we may use a portion of the net proceeds to acquire or invest 
in complementary companies, product lines, products or technologies. However, 
we have no understandings or agreements with respect to any such acquisition 
or investment. 

Pending their use, we plan to invest our net proceeds from this offering in 
short-term, interest-bearing obligations, investment-grade instruments,
certificates of deposit, or direct or guaranteed obligations of the U.S. 
government."
"RENEWABLE ENERGY GROUP, INC.",https://www.nasdaq.com/markets/ipos/company/renewable-energy-group-inc-804642-67691,https://www.nasdaq.com/markets/ipos/company/renewable-energy-group-inc-804642-67691,424B4,1/20/2012,https://www.nasdaq.com/markets/ipos/filing.ashx?filingid=8345672,"We expect that the net proceeds we will receive from the sale of the shares of 
Common Stock offered by us will be approximately $60.9 million, after deducting
the estimated underwriting discounts and commissions and estimated offering 
expenses payable by us. If the underwriters’ over-allotment option to purchase 
additional shares from us is exercised in full, we estimate that we will 
receive additional net proceeds of approximately $10.0 million. We will not 
receive any of the proceeds from the sale of Common Stock by the selling 
stockholders, although we will bear the costs, other than the underwriting 
discounts and commissions, associated with the sale of these shares. The 
selling stockholders include entities affiliated with or controlled by certain 
of our directors. 

We intend to use approximately $12.0 million of the net proceeds we receive 
from this offering to exercise the option we hold to acquire the Seneca 
facility, which we currently lease. The Seneca facility is beneficially owned 
by three of our stockholders: Bunge, USRG, and West Central. The option 
purchase price was determined through negotiation between the current 
beneficial owners and us in a transaction whereby we acquired the facility from
a third party in 2010 and immediately sold the facility to its current owners 
in a sale/leaseback transaction. We also have certain other arrangements and 
agreements in place with these parties. 

The remainder of the net proceeds is expected to be used for working capital, 
capital expenditures related to improvements of production processes and 
logistics, and investments, including potential acquisitions, joint ventures 
and other collaborative arrangements, in new biofuel businesses, production 
technologies or other assets and in opportunities to extend our biorefinery 
platform to the production of renewable chemicals and feedstocks. We have no 
agreements with respect to any material investments at this time. 

If the underwriters’ over-allotment option is exercised, we are obligated to 
use the first $15.0 million of net proceeds, or such lesser amount if the net 
proceeds are less than $15.0 million, to make a one-time special payment to the
former holders of our Series A preferred stock. To the extent that the 
underwriters’ over-allotment option is not exercised, or the net proceeds from 
the exercise of the over-allotment option are less than $15.0 million, upon 
expiration of the 30-day option period, we are obligated to issue up to 400,000
additional shares of Series B preferred stock to the former holders of Series A
preferred stock, such that the maximum number of shares of Series B preferred 
stock that we may issue is 3,000,000. The number of shares of Series B 
preferred stock to be issued to such former holders of Series A preferred stock
will be reduced proportionately for any exercise of the over-allotment option 
resulting in net proceeds in excess of $5.0 million and less than $15.0 
million. If the net proceeds from the exercise of the over-allotment option 
exceed $15.0 million, we intend to use such excess net proceeds as described 
in the preceding paragraphs. 

As of the date of this prospectus, however, except as set forth above, we 
cannot predict with certainty all of the particular uses for the proceeds of 
this offering or the amounts that we will actually spend on the uses set forth 
above. Our management will have significant flexibility in applying the net 
proceeds of this offering. Pending use of the net proceeds as described above, 
we intend to invest the net proceeds of this offering in short-term, interest-
bearing, investment-grade securities."
"HOME LOAN SERVICING SOLUTIONS, LTD.",https://www.nasdaq.com/markets/ipos/company/home-loan-servicing-solutions-ltd-848844-66445,https://www.nasdaq.com/markets/ipos/company/home-loan-servicing-solutions-ltd-848844-66445,424B4,2/29/2012,https://www.nasdaq.com/markets/ipos/filing.ashx?filingid=8451733,"We estimate that the net proceeds to us from this offering will be 
approximately $170 million after deducting underwriting discounts and 
commissions, an advisory services fee and estimated offering expenses that we
must pay. 

Concurrently with this offering, William C. Erbey, the founder of our company 
and the Chairman of our Board of Directors, has agreed to purchase $10 
million of our ordinary shares in the Concurrent Private Placement at a price
per share equal to the initial public offering price, subject to the 
completion of this offering. No underwriting discounts or commissions will
be paid in respect of these shares. 

Pursuant to the Purchase Agreement, we will purchase the Rights to MSRs, 
associated servicing advances and related assets from Ocwen Loan Servicing. 
We will also assume Ocwen Loan Servicing’s obligations under the existing 
advance financing facility. The closing of these transactions will occur 
simultaneously with and is a condition precedent to the closing of the 
Offerings. The estimated purchase price for these assets is $150 million (net 
of assumed match funded liabilities of $361 million and subject to certain 
closing adjustments). The outstanding amount owed on the advance financing 
facility was $383 million as of December 31, 2011. 

The purchase price has two components. The purchase price for the Rights to 
MSRs will be based on our estimates of the value of such assets at the time
we entered into the Purchase Agreement and the outstanding unpaid principal 
balance of the underlying mortgage loans at closing. The purchase price for 
the associated servicing advances and other assets (such as the capitalized 
debt issue costs and facility reserve account) will be equal to the net 
consolidated book value as of the purchase date of all assets and liabilities 
of the special purpose entities established in connection with the advanced 
financing facility that owns these servicing advances, namely HomEq Servicer 
Advance Facility Transferor, LLC (“HomEq Transferor”) and HomEq Servicer 
Advance Receivables Trust 2010-ADV1 (the “Trust”), a Delaware statutory trust 
of which HomEq Transferor is the sole beneficiary. We have agreed to pay 
Barclays Bank PLC, an affiliate of Barclays Capital Inc., a conversion fee 
related to our assumption of the existing advance financing facility equal
 to 0.75% of the sum of (a) the aggregate principal balance of the Class A-1,
Class B and Class C Notes outstanding on the closing date plus (b) the maximum
principal balance of the Class A-2 Note. 

We have obtained an opinion from MIAC relating to the fairness to us, from
a financial point of view, of the purchase price to be paid by us for the 
assets acquired in connection with the Initial Acquisition. MIAC has indicated
that the methodologies and analyses used to value Rights to MSRs are 
substantially similar to those used in connection with the valuation of 
mortgage servicing rights. As a result, MIAC does not believe that the 
structure of the Initial Acquisition has a material impact on its assessment 
of the fairness, from a financial point of view, of the purchase price to us. 
MIAC’s analysis, as more fully described in its fairness opinion, is based on 
an analysis of the present value of expected future cash flows of the Initial 
Mortgage Servicing Rights utilizing assumptions that MIAC believes are 
reasonable and consistent with mortgage servicing industry best practices in 
valuing mortgage servicing assets. The most significant assumptions used are 
estimates of the speed at which mortgages will prepay and the aggregate 
principal amount of mortgage loans that will become delinquent. Other 
significant assumptions used in MIAC’s analysis include the discount rate and
the interest expense for financing servicing advances. The assumptions used 
in the analysis are summarized below: 

• Discount rates reflecting the yield requirements of future income streams
 from the Rights to MSRs ranging from 14% to 22%. 
 
• Interest rate used for calculating the cost of servicing advances of 1-month
 LIBOR + 4%. 
 
• Mortgage loan prepayment projections ranging from 12% to 25% of the related
 mortgage lifetime projected prepayment rate. 
 
• Delinquency rate projections ranging from 15% to over 35% of the aggregate
 unpaid balance of the underlying mortgage loans. 
 
MIAC reviewed the collateral attributes and the historical payment performance
of the Initial Mortgage Servicing Rights and compared it with similar 
mortgage servicing portfolios and with standard industry mortgage performance
benchmarks to arrive at the assumptions set forth above. The selected 
collateral attributes and performance comparisons MIAC utilized were the 
voluntary prepayment performance, delinquency and foreclosure performance, 
operational cost comparison, average loan balance, weighted average coupon 
and note rate distribution, loan product type classification, geographic 
distribution and servicing advance behavior. 

In addition, within the evaluation of the purchase price of the Rights to 
MSRs, MIAC has assumed, based upon a comparison of similar transactions, 
that servicing advances and other assets related to the Initial Mortgage 
Service Assets will be valued and realized at book value. 

We paid MIAC a fee of $300,000 for the delivery of its fairness opinion. 
Amounts paid by us or our affiliates to MIAC were $152,000 and $134,000 in 
2011 and 2010, respectively. 

We will automatically acquire legal ownership of the Initial Mortgage 
Servicing Rights without any additional payment to Ocwen Loan Servicing if 
and when we obtain the Required Third Party Consents and therefore, no 
proceeds from the Offerings will be used for that purpose. 

We intend to use any remaining net proceeds from the Offerings for working 
capital and general corporate purposes, which may include the repayment of 
indebtedness or the purchase of additional Rights to MSRs or mortgage 
servicing rights."
PROTO LABS INC,https://www.nasdaq.com/markets/ipos/company/proto-labs-inc-786297-67741,https://www.nasdaq.com/markets/ipos/company/proto-labs-inc-786297-67741,424B4,2/27/2012,https://www.nasdaq.com/markets/ipos/filing.ashx?filingid=8437656,"We estimate that the net proceeds to us from the sale of the shares of common 
stock offered by us will be approximately $62.0 million based upon the initial
public offering price of $16.00 per share, after deducting estimated 
underwriting discounts and commissions and estimated offering expenses payable
by us. If the underwriters fully exercise their over-allotment option, we 
estimate that the net proceeds to us from this offering will be approximately 
$71.6 million. 

We currently intend to use the net proceeds we receive from this offering for 
working capital and other general corporate purposes. We may also use 
a portion of the net proceeds to in-license, acquire or invest in 
complementary businesses, technologies, products or assets, as well as add 
incremental capacity. However, we have no current commitments or obligations 
to do so. Pending use of the net proceeds from this offering, we intend to 
invest the net proceeds in short- and intermediate-term interest-bearing 
obligations, investment-grade instruments, certificates of deposit or direct 
or guaranteed obligations of the U.S. government. 

By establishing a public market for our common stock, this offering is also 
intended to facilitate our future access to public markets."
