"LIFELOCK, INC.",https://www.nasdaq.com/markets/ipos/company/lifelock-inc-729273-70640,https://www.nasdaq.com/markets/ipos/company/lifelock-inc-729273-70640,424B4,10/3/2012,https://www.nasdaq.com/markets/ipos/filing.ashx?filingid=8850556,"We estimate that our net proceeds from the sale of our common stock in this 
offering will be approximately $126.0 million, based upon the initial public 
offering price of $9.00 per share and after deducting the underwriting discount
and estimated offering expenses payable by us. If the underwriters’ option to 
purchase additional shares in this offering is exercised in full, we estimate 
that our net proceeds will be approximately $145.7 million after deducting the 
underwriting discount and estimated offering expenses payable by us. We will 
not receive any of the proceeds from the sale of common stock by the selling 
stockholders. 

We intend to use approximately $62.6 million of the net proceeds from this 
offering to repay the outstanding balance under our term loan incurred in 
connection with our acquisition of ID Analytics. As of June 30, 2012, the 
interest rate on the term loan, which is scheduled to mature on February 7, 
2016, was 4.49%. 

Since the anticipated initial public offering price is below $15.7552 per 
share, we intend to use approximately $10.7 million of the net proceeds from 
this offering to pay the amounts that will be payable to the holders of our 
Series E-1 preferred stock. For every $0.01 the anticipated initial public 
offering price is below $15.7552 per share, we are obligated to pay $0.01 per 
share in cash to the holders of our Series E-1 preferred stock. As of the date 
of this prospectus, there were 1,586,778 shares of our Series E-1 preferred 
stock outstanding. 

We intend to use the remaining net proceeds from this offering for working 
capital and other general corporate purposes, including supporting our revenue 
growth, enhancing our sales and marketing activities, entering new markets, and
developing new service offerings. We also may use a portion of the net proceeds
from this offering to acquire businesses, products, services, or technologies 
that we believe to be complementary to our business. However, we do not have 
agreements or commitments for any specific acquisitions at this time. 

Our plans for the proceeds of this offering are subject to change due to 
unforeseen events and opportunities, and the amounts and timing of our actual 
expenditures depend on several factors, including our expansion plans and the 
amount of cash generated or used by our operations. Other than as described 
above, we cannot specify with certainty the particular uses for the net 
proceeds to be received upon the closing of this offering. Accordingly, we will
have broad discretion in using the net proceeds of this offering. Pending these
uses, we intend to invest the net proceeds from this offering in short-term, 
investment-grade, interest-bearing securities such as money market funds, 
certificates of deposit, commercial paper, and guaranteed obligations of the 
U.S. government. 

Each of Bank of America, N.A., an affiliate of Merrill Lynch, Pierce, Fenner & 
Smith Incorporated, an underwriter in this offering, and Royal Bank of Canada, 
an affiliate of RBC Capital Markets, LLC, an underwriter in this offering, is 
a lender under the term loan portion of our senior credit facility and will 
receive more than five percent of the net proceeds of this offering. Thus, both
Merrill Lynch, Pierce, Fenner & Smith Incorporated and RBC Capital Markets, 
LLC have a “conflict of interest” under the applicable provisions of Rule 5121 
of the Conduct Rules of FINRA. Accordingly, this offering will be made in 
compliance with the applicable provisions of Rules 5110 and 5121 of the Conduct
Rules regarding the underwriting of securities of a company with a member that 
has a conflict of interest within the meaning of those rules. Deutsche Bank 
Securities Inc. has agreed to serve as a “qualified independent underwriter” as
defined by FINRA and performed due diligence investigations and reviewed and 
participated in the preparation of the registration statement of which this 
prospectus forms a part. No underwriter with a conflict of interest will 
execute sales in discretionary accounts without the prior written specific 
approval of the customers."
LUXFER HOLDINGS PLC,https://www.nasdaq.com/markets/ipos/company/luxfer-holdings-plc-107562-68738,https://www.nasdaq.com/markets/ipos/company/luxfer-holdings-plc-107562-68738,424B4,10/4/2012,https://www.nasdaq.com/markets/ipos/filing.ashx?filingid=8854397,"We expect to receive total estimated net proceeds from this offering of 
approximately $55.1 million, or $60.7 million if the underwriters exercise 
the overallotment option in full, in each case after deducting estimated 
underwriting discounts and estimated expenses of the offering payable by us. 
We will not receive any proceeds from the sale of ADSs by the selling 
shareholders. 

We intend to use the net proceeds of this offering received by us (i) to 
repay the entire amount outstanding under our Term Loan, which was $46.6 
million as of June 30, 2012 and (ii) for other general corporate purposes. 

Loans drawn under our Term Loan are repayable in full on or before May 6, 
2015. Our indebtedness under the Term Loan bears interest at EURIBOR, in the 
case of amounts drawn in euros, or LIBOR, in the case of amounts drawn in 
pound sterling or U.S. dollars, plus an applicable margin that is set at 2.5% 
per annum until June 15, 2012 and then every quarter end thereafter at 
between 1.75% and 2.75% per annum depending on Luxfer Holdings PLC's net debt 
to EBITDA ratio plus mandatory costs (if any). 

The amount of net proceeds devoted to the foregoing uses may vary from these 
amounts, and we may devote some or all of the net proceeds of the offering to 
other uses as a result of changing business conditions or other developments 
subsequent to the offering."
JAVELIN MORTGAGE INVESTMENT CORP.,https://www.nasdaq.com/markets/ipos/company/javelin-mortgage-investment-corp-885185-70270,https://www.nasdaq.com/markets/ipos/company/javelin-mortgage-investment-corp-885185-70270,424B4,10/4/2012,https://www.nasdaq.com/markets/ipos/filing.ashx?filingid=8853103,"We are offering 7,250,000 shares of our common stock at an initial public 
offering price of $20.00 per share. SBBC will pay the underwriters all 
underwriting discounts and commissions payable with respect to all shares sold 
in this offering. We will not reimburse SBBC for its payment of these 
underwriting discounts and commissions. Concurrent with the closing of this 
offering, we are selling an aggregate of 250,000 shares of common stock at 
$20.00 per share in a private placement to an entity controlled by Messrs. 
Staton and Bell. We estimate that the net proceeds that we receive from this 
offering and the concurrent private placement will be approximately 
$150,000,000 (or approximately $171,750,000 if the underwriters exercise their 
over-allotment option in full). Our organizational costs and other costs 
related to this offering and the concurrent private placement will also be paid
by SBBC and we will not reimburse SBBC for these costs. 

We plan to use all the net proceeds from this offering and the concurrent 
private placement to acquire our target assets in accordance with our 
objectives and strategies described in this prospectus. Our focus will be on 
purchasing agency mortgage-backed securities, non-agency mortgage-backed 
securities and other mortgage-related investments, subject to our investment 
guidelines and REIT qualification requirements. ARRM will make determinations 
as to the percentage of our target assets that will be invested in each of our 
target assets. These decisions will depend on prevailing market conditions and 
may change over time in response to opportunities available in different 
interest rate, economic and credit environments. Until appropriate assets can 
be identified, the net proceeds from this offering and the concurrent private 
placement may be invested in interest-bearing short-term investments, including
funds that are consistent with our qualification as a REIT. These investments 
are expected to provide a lower net return than we will seek to achieve from 
our target assets. We anticipate that we will be able to identify a sufficient 
amount of investments in agency mortgage-backed securities and non-agency 
mortgage-backed securities within approximately one to three months after the 
closing of the offering and the concurrent private placement. However, 
depending on the availability of appropriate investment opportunities and 
subject to prevailing market conditions, there can be no assurance that we 
will be able to identify a sufficient amount of investments within this 
timeframe."
YY INC.,https://www.nasdaq.com/markets/ipos/company/yy-inc-891344-70972,https://www.nasdaq.com/markets/ipos/company/yy-inc-891344-70972,424B4,11/21/2012,https://www.nasdaq.com/markets/ipos/filing.ashx?filingid=8931645,"We estimate that we will receive net proceeds from this offering of
approximately US$71.5 million, or approximately US$82.9 million if the
underwriters exercise their option to purchase additional ADSs in full, after
deducting underwriting discounts and commissions and the estimated offering
expenses payable by us.

The primary purposes of this offering are to create a public market for our
shares for the benefit of all shareholders, retain talented employees by
providing them with equity incentives and obtain additional capital. We intend
to use the net proceeds from this offering for the following purposes:

     •   approximately US$15.0 million to invest in our voice and video technology 
         and infrastructure, including purchasing servers and leasing more         
         bandwidth to support our expanding user base and further enhancing user   
         experience;                                                               

     •   approximately US$15.0 million to expand our product development and       
         services offerings, including through the hiring of additional research   
         and development personnel and the further development of Mobile YY;       

     •   approximately US$15.0 million to expand our sales and marketing           
         activities, including the hiring of additional sales and marketing        
         personnel; and                                                            

     •   the balance for other general corporate purposes, including working       
         capital needs, potential acquisitions, partnerships, alliances and        
         licensing opportunities.                                                  

The amounts and timing of any expenditures will vary depending on the amount of
cash generated by our operations, and the rate of growth, if any, of our
business. Accordingly, our management will have significant flexibility in
applying the net proceeds of the offering. If an unforeseen event occurs or
business conditions change, we may use the proceeds of this offering differently
than as described in this prospectus.

In utilizing the proceeds from this offering, we are permitted under PRC laws
and regulations to provide funding to our PRC subsidiaries only through loans or
capital contributions, and only if we satisfy the applicable government
registration and approval requirements. We cannot assure you that we will be
able to meet these requirements on a timely basis, if at all. 

Pending use of the net proceeds, we intend to hold our net proceeds in demand
deposits or invest them in interest-bearing government securities."
"ALON USA PARTNERS, LP",https://www.nasdaq.com/markets/ipos/company/alon-usa-partners-lp-888763-70662,https://www.nasdaq.com/markets/ipos/company/alon-usa-partners-lp-888763-70662,424B4,11/21/2012,https://www.nasdaq.com/markets/ipos/filing.ashx?filingid=8931871,"We will receive net proceeds of approximately $146.8 million from the sale of
10,000,000 common units offered by this prospectus, after deducting the
underwriting discount and estimated offering expenses payable by us.

We intend to use the net proceeds of this offering to repay approximately
$146.8 million of principal and accrued interest relating to intercompany debt
payable by our subsidiaries to Alon Energy and its affiliates.

As of September 30, 2012, we had approximately $346.6 million in intercompany
debt payable to Alon Energy and certain of its subsidiaries with a January 2018
maturity and a weighted-average interest rate of approximately 8.0%. It is
expected that an additional $51.5 million of intercompany debt payable, which
has currently been eliminated in the Alon USA Partners, LP Predecessor combined
financial statements, will be transferred to Alon Energy or one of its
subsidiaries prior to closing. The transfer will cause the intercompany debt
payable to Alon Energy to increase from $346.6 million at September 30, 2012, to
approximately $398.1 million. This intercompany debt was incurred to satisfy
working capital requirements, fund acquisitions and for general corporate
purposes. We expect that the remaining balance of the intercompany debt will be
eliminated prior to closing or in connection with the underwriters’ option to
purchase additional common units, and we do not expect that we will incur any
significant additional intercompany debt following the closing of this offering.
In addition, we expect to have approximately $84.0 million and $250 million
outstanding under our amended and restated revolving credit facility and new
term loan facility following the closing of this offering, respectively. We do
not currently expect to draw significant amounts under our amended and restated
revolving credit facility following the closing of this offering other than in
the ordinary course to fund capital expenditures and our working capital needs.

The net proceeds from any exercise of the underwriters’ option to purchase
additional common units (approximately $22.3 million, if exercised in full) will
be distributed to Alon Energy as repayment of intercompany debt and in whole or
in part as reimbursement for certain pre-formation capital expenditures. If the
underwriters do not exercise their option to purchase additional common units,
we will issue 1,500,000 common units to Alon Energy at the expiration of the
option period as satisfaction of all remaining intercompany debt. If and to the
extent the underwriters exercise their option to purchase additional common
units, the number of units purchased by the underwriters pursuant to such
exercise will be issued to the public and the remainder, if any, will be issued
to Alon Energy as satisfaction of all remaining intercompany debt. Accordingly,
the exercise of the underwriters’ option will not affect the total number of
units outstanding or the amount of cash available to pay distributions on our
common units.

Certain of the underwriters and their affiliates have engaged, and may in the
future engage, in commercial banking, investment banking and advisory services
for us, Alon Energy and our respective affiliates from time to time in the
ordinary course of their business for which they have received customary fees
and reimbursement of expenses. Affiliates of certain of the underwriters are
expected to be lenders under our new term loan facility. Certain of the
underwriters or their affiliates have performed or will perform commercial
banking, investment banking and advisory services for Alon Energy during the
180-day period prior to, or the 90-day period following, the date of this
prospectus, for which they have received or will receive customary fees and
reimbursement or expenses."
"WHEELER REAL ESTATE INVESTMENT TRUST, INC.",https://www.nasdaq.com/markets/ipos/company/wheeler-real-estate-investment-trust-inc-862208-68347,https://www.nasdaq.com/markets/ipos/company/wheeler-real-estate-investment-trust-inc-862208-68347,424B3,11/15/2012,https://www.nasdaq.com/markets/ipos/filing.ashx?filingid=8920778,"After deducting the placement fee and commissions and estimated expenses of 
this offering and the formation transactions, we expect net proceeds from 
this offering of approximately $13.39 million, assuming completion of the 
minimum offering, or $18.19 million, assuming completion of the maximum 
offering at the initial public offering price of $5.25 per share. 

We intend to contribute the net proceeds of this offering to our Operating 
Partnership in exchange for common units and our Operating Partnership will 
use the net proceeds received from us as described below: 

• Approximately $0.5 million to repay outstanding indebtedness. 

• Approximately $2.0 million for general working capital, which will initially 
be used to fund dividend payments. 

• Approximately $1.78 million to reimburse our Operating Partnership for the 
purchase of the membership interests of DF-1 Carrollton, LLC, the current 
owner of The Shoppes at Eagle Harbor, one of the original eight properties 
in our operating portfolio. 

• Approximately $4.18 million in cash payments to those Prior Investors who 
have elected to receive cash instead of Operating Partnership Units for their 
contribution of membership interests in the Ownership Entities. 

• The balance, approximately $4.93 million (assuming a minimum offering) or 
$9.73 million (assuming a maximum offering) will be used for future 
acquisitions."
"WHEELER REAL ESTATE INVESTMENT TRUST, INC.",https://www.nasdaq.com/markets/ipos/company/wheeler-real-estate-investment-trust-inc-862208-68347,https://www.nasdaq.com/markets/ipos/company/wheeler-real-estate-investment-trust-inc-862208-68347,424B3,11/13/2012,https://www.nasdaq.com/markets/ipos/filing.ashx?filingid=8912934,"After deducting the placement fee and commissions and estimated expenses of 
this offering and the formation transactions, we expect net proceeds from 
this offering of approximately $13.39 million, assuming completion of the 
minimum offering, or $18.19 million, assuming completion of the maximum 
offering at the initial public offering price of $5.25 per share. 

We intend to contribute the net proceeds of this offering to our Operating 
Partnership in exchange for common units and our Operating Partnership will 
use the net proceeds received from us as described below: 

• Approximately $0.5 million to repay outstanding indebtedness. 

• Approximately $2.0 million for general working capital, which will initially 
be used to fund dividend payments. 

• Approximately $1.78 million to reimburse our Operating Partnership for the 
purchase of the membership interests of DF-1 Carrollton, LLC, the current 
owner of The Shoppes at Eagle Harbor, one of the original eight properties 
in our operating portfolio. 

• Approximately $4.18 million in cash payments to those Prior Investors who 
have elected to receive cash instead of Operating Partnership Units for their 
contribution of membership interests in the Ownership Entities. 

• The balance, approximately $4.93 million (assuming a minimum offering) or 
$9.73 million (assuming a maximum offering) will be used for future 
acquisitions."
RUCKUS WIRELESS INC,https://www.nasdaq.com/markets/ipos/company/ruckus-wireless-inc-639489-70923,https://www.nasdaq.com/markets/ipos/company/ruckus-wireless-inc-639489-70923,424B4,11/16/2012,https://www.nasdaq.com/markets/ipos/filing.ashx?filingid=8922226,"We estimate that the net proceeds we will receive from this offering will be 
approximately $94.4 million, based upon the initial public offering price of 
$15.00 per share, after deducting estimated underwriting discounts and 
commissions and estimated offering expenses payable by us. If the underwriters 
exercise their option to purchase additional shares from the selling 
stockholders in this offering, there will be no change in the total proceeds to
us. We will not receive any of the proceeds from the sale of shares by the 
selling stockholders, although we will bear the costs, other than underwriting 
discounts and commissions, associated with those sales. 

The principal purposes of this offering are to create a public market for our 
common stock and thereby enable access to the public equity markets by our 
employees and stockholders, obtain additional capital and increase our 
visibility in the marketplace. As of the date of this prospectus we have no 
specific plans for the use of the net proceeds we receive from this offering. 
We intend to use the net proceeds from this offering for working capital and 
other general corporate purposes, including sales and marketing activities and 
products development. We may also use a portion of the net proceeds for the 
acquisition of, or investment in, technologies, solutions or businesses that 
complement our business, although we have no present commitments or agreements 
to enter into any acquisitions or investments. Pending these uses, we plan to 
invest these net proceeds in short-term, interest bearing obligations, 
investment grade instruments, certificates of deposit or direct or guaranteed 
obligations of the United States. The goal with respect to the investment of 
these net proceeds is capital preservation and liquidity so that such funds are
readily available to fund our operations. 

We will have broad discretion in the application of the net proceeds and 
investors will be relying on the judgment of our management regarding the 
application of the net proceeds of this offering."
"MILLENDO THERAPEUTICS, INC.",https://www.nasdaq.com/markets/ipos/company/millendo-therapeutics-inc-879168-70641,https://www.nasdaq.com/markets/ipos/company/millendo-therapeutics-inc-879168-70641,424B3,9/13/2013,https://www.nasdaq.com/markets/ipos/filing.ashx?filingid=9507523,"We are filing the registration statement of which this prospectus is a part to 
permit holders of the shares of our common stock. We will not receive any 
proceeds from the resale of any shares offered by this prospectus by the selling
stockholders."
"MILLENDO THERAPEUTICS, INC.",https://www.nasdaq.com/markets/ipos/company/millendo-therapeutics-inc-879168-70641,https://www.nasdaq.com/markets/ipos/company/millendo-therapeutics-inc-879168-70641,424B3,8/13/2013,https://www.nasdaq.com/markets/ipos/filing.ashx?filingid=9453548,"We are filing the registration statement of which this prospectus is a part to 
permit holders of the shares of our common stock. We will not receive any 
proceeds from the resale of any shares offered by this prospectus by the selling
stockholders."
"MILLENDO THERAPEUTICS, INC.",https://www.nasdaq.com/markets/ipos/company/millendo-therapeutics-inc-879168-70641,https://www.nasdaq.com/markets/ipos/company/millendo-therapeutics-inc-879168-70641,424B3,7/30/2013,https://www.nasdaq.com/markets/ipos/filing.ashx?filingid=9420920,"We are filing the registration statement of which this prospectus is a part to 
permit holders of the shares of our common stock. We will not receive any 
proceeds from the resale of any shares offered by this prospectus by the selling
stockholders."
"MILLENDO THERAPEUTICS, INC.",https://www.nasdaq.com/markets/ipos/company/millendo-therapeutics-inc-879168-70641,https://www.nasdaq.com/markets/ipos/company/millendo-therapeutics-inc-879168-70641,424B3,7/2/2013,https://www.nasdaq.com/markets/ipos/filing.ashx?filingid=9384343,"We are filing the registration statement of which this prospectus is a part to 
permit holders of the shares of our common stock. We will not receive any 
proceeds from the resale of any shares offered by this prospectus by the selling
stockholders."
"MILLENDO THERAPEUTICS, INC.",https://www.nasdaq.com/markets/ipos/company/millendo-therapeutics-inc-879168-70641,https://www.nasdaq.com/markets/ipos/company/millendo-therapeutics-inc-879168-70641,424B3,6/13/2013,https://www.nasdaq.com/markets/ipos/filing.ashx?filingid=9351737,"We are filing the registration statement of which this prospectus is a part to 
permit holders of the shares of our common stock. We will not receive any 
proceeds from the resale of any shares offered by this prospectus by the selling
stockholders."
"MILLENDO THERAPEUTICS, INC.",https://www.nasdaq.com/markets/ipos/company/millendo-therapeutics-inc-879168-70641,https://www.nasdaq.com/markets/ipos/company/millendo-therapeutics-inc-879168-70641,424B3,5/15/2013,https://www.nasdaq.com/markets/ipos/filing.ashx?filingid=9297179,"We are filing the registration statement of which this prospectus is a part to 
permit holders of the shares of our common stock. We will not receive any 
proceeds from the resale of any shares offered by this prospectus by the selling
stockholders."
"MILLENDO THERAPEUTICS, INC.",https://www.nasdaq.com/markets/ipos/company/millendo-therapeutics-inc-879168-70641,https://www.nasdaq.com/markets/ipos/company/millendo-therapeutics-inc-879168-70641,424B3,5/3/2013,https://www.nasdaq.com/markets/ipos/filing.ashx?filingid=9268308,"We are filing the registration statement of which this prospectus is a part to 
permit holders of the shares of our common stock. We will not receive any 
proceeds from the resale of any shares offered by this prospectus by the selling
stockholders."
"MILLENDO THERAPEUTICS, INC.",https://www.nasdaq.com/markets/ipos/company/millendo-therapeutics-inc-879168-70641,https://www.nasdaq.com/markets/ipos/company/millendo-therapeutics-inc-879168-70641,424B3,4/26/2013,https://www.nasdaq.com/markets/ipos/filing.ashx?filingid=9242241,"We are filing the registration statement of which this prospectus is a part to 
permit holders of the shares of our common stock. We will not receive any 
proceeds from the resale of any shares offered by this prospectus by the selling
stockholders."
