BGS ACQUISITION CORP.,https://www.nasdaq.com/markets/ipos/company/bgs-acquisition-corp-870797-68926,https://www.nasdaq.com/markets/ipos/company/bgs-acquisition-corp-870797-68926,424B4,3/21/2012,https://www.nasdaq.com/markets/ipos/filing.ashx?filingid=8496770,"We are offering 4,000,000 units at an offering price of $10.00 per unit. We 
estimate that the net proceeds of this offering together with the funds we will 
receive from the sale of the investor warrants and the underwriter warrants 
will be used as set forth in the following table. 

                                                   Without          Over-
                                                   Over-            Allotment 
                                                   Allotment        Option 
                                                   Option           Exercised 

Gross proceeds 
                                                   
Gross proceeds from units offered to public(1)  $  40,000,000     $  46,000,000
Gross proceeds from warrants offered in the 
private placement                                   2,450,000         2,450,000
Total gross proceeds                            $  42,450,000     $  48,450,000
Estimated Offering expenses (2) 
                                                   
Underwriting commissions (3.0% of gross proceeds 
from units offered to public, excluding deferred 
corporate finance fee) (3)                      $   1,200,000     $   1,380,000
Legal fees and expenses                               270,000           270,000
Printing and engraving expenses                        38,000            38,000
Accounting fees and expenses                           40,000            40,000
NASDAQ Capital Market Listing fees                     50,000            50,000
SEC filing fees                                        14,117            14,117
FINRA Registration fee                                 12,819            12,819
Miscellaneous                                          25,064            25,064
Total offering expenses                         $   1,650,000     $   1,830,000
Proceeds after offering expenses                $  40,800,000     $  46,620,000
Not held in trust account                       $     200,000     $     200,000
Held in trust account (3)                       $  40,600,000     $  46,420,000
% of public offering size                           101.50  %         100.90  %
  
The following table shows the use of the $200,000 of net proceeds not held in 
the trust account, an additional $115,000 (based on current estimated yields) 
of interest earned on our trust account (net of taxes payable) that may be 
available to us to cover operating expenses and up to $500,000 in loans for a 
total of $815,000. 

                                                         Amount     Percentage
 
Legal, accounting, due diligence, travel, and other 
expenses in connection with any business combination    $  400,000    49.1  %
Legal and accounting fees related to regulatory 
reporting obligations                                      150,000    18.4  %
Director and Officer Insurance                             125,000    15.3  %
Other miscellaneous expenses                               140,000    17.2  %

Total                                                   $  815,000   100.0  % 

(1)   Includes amounts payable to public shareholders who properly redeem their
      shares in connection with our successful consummation of our initial 
      business combination.  

(2)   In addition, a portion of the offering expenses have been prepaid from 
      the proceeds of an aggregate of $176,760 loan from our Chairman, Julio 
      Gutierrez, as described in this prospectus. The loan will be repaid 
      without interest upon the closing of this offering out of the amount of 
      offering proceeds that has been allocated for the payment of offering 
      expenses other than underwriting commissions. In the event that such 
      amount is not enough to repay the loan, the loans may be converted, at 
      the option Mr. Gutierrez, into an equivalent amount of warrants on the 
      same terms as the investor warrants and the underwriter warrants. In the 
      event that offering expenses are less than set forth in this table, any 
      such amounts will be used for post-closing working capital expenses.  

(3)   The underwriting discount of 3.0% is payable at the closing of the 
      offering and the deferred corporate finance fee of 2.0% is payable upon 
      consummation of our initial business combination and will be held in the 
      trust account until consummation of such business combination.  

(4)   Our chairman, Julio Gutierrez, has agreed to loan us up to an aggregate 
      of $500,000 (or a higher amount at his discretion) to fund our working 
      capital needs following the consummation of this offering and before our 
      initial business combination. In the event that our initial business 
      combination does not close, we may use a portion of the offering proceeds
      held outside the trust account to repay such loaned amounts but no 
      proceeds from our trust account would be used for such repayment. In the 
      event our initial business combination is consummated, Mr. Gutierrez, at 
      his option, may convert the loans into warrants of the target company at 
      $0.75 per warrant. In accordance with the foregoing, we will enter into 
      an agreement setting forth the terms of the loans with Mr. Gutierrez.  

A total of $40,600,000 ($46,420,000 if the underwriters’ over-allotment option 
is exercised in full) of the net proceeds from this offering and the sale of 
the investor warrants and the underwriter warrants described in this 
prospectus, including $800,000 ($920,000 if the underwriters’ over-allotment 
option is exercised in full) deferred corporate finance fee, will be placed in 
a trust account with Continental Stock Transfer & Trust Company acting as 
trustee and will be invested only in U.S. government treasury bills with a 
maturity of 180 days or less or in money market funds meeting certain 
conditions under Rule 2a-7 under the Investment Company Act and that invest 
solely in U.S. Treasuries. Except for the interest income that may be released 
to us to pay any taxes and to fund our working capital requirements, as 
discussed below, and any amounts necessary to purchase up to 15% of our public 
shares if we are no longer an FPI and seek shareholder approval of our business
combination as will be permitted under our memorandum and articles of 
association and the investment management trust agreement to be entered into 
between us and Continental Stock Transfer & Trust Company, none of the funds 
held in trust will be released from the trust account until the earlier of: 
(i) the consummation of our initial business combination within 15 months from 
the closing of this offering (or 18 months from the closing of this offering 
if we have entered into a definitive agreement with a target business within 
such 15 month period) and (ii) a redemption to public shareholders prior to any
voluntary winding-up in the event we do not consummate our initial business 
combination within the applicable period. 

The net proceeds held in the trust account may be used as consideration to pay 
the sellers of a target business with which we ultimately complete our initial 
business combination. If our initial business combination is paid for using 
shares or debt securities, or not all of the funds released from the trust 
account are used for payment of the purchase price in connection with our 
business combination, we may apply the cash released from the trust account 
that is not applied to the purchase price for general corporate purposes, 
including for maintenance or expansion of operations of acquired businesses, 
the payment of principal or interest due on indebtedness incurred in 
consummating our initial business combination, to fund the purchase of other 
companies or for working capital. 

We believe that amounts not held in trust, as well as the interest income that 
may be released to fund our working capital requirements in addition to the 
loans discussed below will be sufficient to pay the costs and expenses to which
such proceeds are allocated. This belief is based on the fact that while we may
begin preliminary due diligence of a target business in connection with an 
indication of interest, we intend to undertake in-depth due diligence, 
depending on the circumstances of the relevant prospective acquisition, only 
after we have negotiated and signed a letter of intent or other preliminary 
agreement that addresses the terms of our initial business combination. 
However, if our estimate of the costs of undertaking in-depth due diligence and
negotiating our initial business combination is less than the actual amount 
necessary to do so, or the amount of interest available to use from the trust 
account is less than $115,000 as a result of the current interest rate 
environment, we may be required to raise additional capital, the amount, 
availability and cost of which is currently unascertainable. In this event, Mr.
Gutierrez has agreed to loan us up to an aggregate of $500,000 (or a higher 
amount at his discretion) to fund our working capital needs following the 
consummation of this offering and before our initial business combination. In 
the event that our initial business combination does not close, we may use a 
portion of the offering proceeds held outside the trust account to repay such 
loaned amounts but no proceeds from our trust account would be used for such 
repayment, other than the interest on such proceeds that may be released to us 
for working capital purposes. 

In the event our initial business combination is consummated, Mr. Gutierrez, at
his option, may convert the loans into warrants of the target company at $0.75 
per warrant. 

As of the date of this prospectus, Julio Gutierrez has loaned and advanced to 
us a total of $176,760 to be used for a portion of the expenses of this 
offering. These advances are non-interest bearing, unsecured and are due at the
earlier of September 30, 2012 or the closing of this offering. The loan will be
repaid upon the closing of this offering out of the amount of offering proceeds
that has been allocated to the payment of offering expenses. 

Unlike many blank check companies, if we are no longer an FPI and seek 
shareholder approval of our initial business combination and we do not conduct 
redemptions in connection with our business combination pursuant to the tender 
offer rules prior to the consummation of our initial business combination, our 
memorandum and articles of association and the investment management trust 
agreement to be entered into between us and Continental Stock Transfer & Trust 
Company will permit the release to us from the trust account of amounts 
necessary to purchase up to 15% of the public shares (600,000 shares, or 
690,000 shares if the underwriters’ over-allotment option is exercised in full)
at any time commencing after the filing of a preliminary proxy statement for 
our initial business combination and ending on the record date for the vote to 
be held to approve our initial business combination. Purchases will be made 
only in open market transactions at times when we are not in possession of any 
material non-public information and may not be made during a restricted period 
under Regulation M under the Exchange Act. Due to the relatively sporadic 
public trading of securities of similarly structured blank check companies, it 
is unlikely that we would be able to make such purchases under Rule 10b-18 
under the Exchange Act and still accomplish the intended goals of such 
purchases as described below. Therefore, we do not intend to comply with Rule 
10b-18 and may make purchases outside of the requirements of Rule 10b-18 as we 
see fit. This could result in our liability for manipulation under Section 9(a)
(2) and Rule 10b-5 of the Exchange Act. We can purchase any or all of the 
600,000 shares (or 690,000 shares if the underwriters’ over-allotment option 
is exercised in full) we are entitled to purchase. It will be entirely in our 
discretion as to how many shares are purchased. Purchasing decisions will be 
made based on various factors, including the then current market price of our 
ordinary shares and the terms of the proposed business combination. All shares 
purchased by us will be immediately cancelled. Such open market purchases, if 
any, would be conducted by us to minimize any disparity between the then 
current market price of our ordinary shares and the per-share amount held in 
the trust account. A market price below the per-share trust amount could 
provide an incentive for purchasers to buy our shares after the filing of our 
preliminary proxy statement at a discount to the per-share amount held in the 
trust account for the sole purpose of voting against our initial business 
combination and exercising redemption rights for the full per-share amount held
in the trust account. Such trading activity could enable such investors to 
block our initial business combination by making it more difficult for us to 
obtain the approval of such business combination by the vote of a majority of 
our outstanding ordinary shares that are entitled to vote and are voted. 

If we are no longer an FPI and seek shareholder approval of our initial 
business combination and we do not conduct redemptions in connection with our 
business combination pursuant to the tender offer rules, we may enter into 
privately negotiated transactions to purchase public shares from shareholders 
following our consummation of our initial business combination with proceeds 
released to us from the trust account immediately following consummation of our
initial business combination. Our initial shareholder, directors, officers, 
advisors or their affiliates may also purchase shares in privately negotiated
transactions either prior to or following the consummation of our initial 
business combination. Neither we nor our directors, officers, advisors or their
affiliates will make any such purchases when we or they are in possession of 
any material non-public information not disclosed to the seller or during a 
restricted period under Regulation M under the Exchange Act. Although we do not
currently anticipate paying any premium purchase price (over the trust value) 
for such public shares, in the event we do, the payment of a premium may not be
in the best interest of those shareholders not receiving any such premium. In 
addition, the payment of a premium by us after the consummation of our initial 
business combination may not be in the best interest of the remaining 
shareholders who do not redeem their shares. Such shareholders may experience a
reduction in book value per share compared to the value received by 
shareholders that have their shares purchased by us at a premium. Nevertheless,
because any payment of a premium by us will be made only from proceeds released
to us from the trust account following completion of a business combination, no
such payments will reduce the per share amounts available in the trust account 
for redemption in connection with the business combination. Except for the 
limitations described above on use of trust proceeds released to us prior to 
consummating our initial business combination, there is no limit on the amount 
of shares that could be acquired by us or our affiliates, or the price we or 
they may pay, if we hold a shareholder vote. 

In no event will we redeem our public shares in an amount that would cause our 
net tangible assets to be less than $5,000,001. Furthermore, the redemption 
threshold may be further limited by the terms and conditions of our initial 
business combination. In such case, we would not proceed with the redemption of
our public shares or the business combination, and instead may search for an 
alternate business combination. 

A public shareholder will be entitled to receive funds from the trust account 
only upon the earlier to occur of: (i) our consummation of an initial business 
combination, and then only in connection with those ordinary shares that such 
shareholder properly elected to redeem, subject to the limitations described 
herein or (ii) the redemption of our public shares if we are unable to 
consummate our initial business combination within 15 months following the 
closing of this offering (or 18 months from the closing of this offering if we 
have entered into a definitive agreement with a target business for our initial
business combination within 15 months from the consummation of this offering 
and such business combination has not yet been consummated within such 15 month
period), subject to applicable law and as further described herein and any 
limitations (including but not limited to cash requirements) created by the 
terms of the proposed business combination. In no other circumstances will a 
public shareholder have any right or interest of any kind to or in the trust 
account. 

Our initial shareholder has agreed to waive his redemption rights with respect 
to any founder shares and public shares in connection with the consummation of 
our initial business combination. Our officers and directors have also agreed 
to waive their redemption rights with respect to any public shares purchased 
during or after the offering in connection with the consummation of our initial
business combination. In addition, our initial shareholder has agreed to waive 
his right to liquidating distributions with respect to the founder shares if we
fail to consummate our initial business combination within 15 months from the 
closing of this offering or 18 months from the closing of this offering if we 
have entered into a definitive agreement with a target business for our initial
business combination within 15 months from the consummation of this offering 
and such business combination has not yet been consummated within such 15 month
period. However, if our initial shareholder, or any of our officers, directors 
or affiliates acquire public shares in or after this offering, they will be 
entitled to receive liquidating distributions with respect to such public 
shares if we fail to consummate our initial business combination within the 
required time period."
