NEWALLIANCE BANCSHARES INC,https://www.nasdaq.com/markets/ipos/company/newalliance-bancshares-inc-597810-35715,https://www.nasdaq.com/markets/ipos/company/newalliance-bancshares-inc-597810-35715,424B3,2/17/2004,https://www.nasdaq.com/markets/ipos/filing.ashx?filingid=2773621,"The amount of net proceeds will depend on the total number of shares of common 
stock sold in the offering, which in turn will depend on RP Financial’s 
appraisal as well as regulatory and market considerations, and the expenses 
incurred in connection with the offering. Although we will not be able to 
determine the actual net proceeds from the sale of the common stock until we 
complete the offering, we estimate the net proceeds will be between $649.4 
million and $879.7 million, or $1.012 billion if the offering is increased by 
15%. 

The net proceeds may vary because the total expenses relating to the offering 
may be more or less than our estimates. For example, our expenses would 
increase if a syndicated community offering is used to sell shares not purchased 
in the subscription offering and community offering. The net proceeds will also 
vary if the number of shares to be sold in the offering is adjusted to reflect 
a change in the estimated pro forma market value of New Haven Savings Bank or 
if our employee stock ownership plan purchases shares in the open market at an 
average cost that is higher or lower than the $10.00 per share offering price. 
Payments for shares made through withdrawals from existing deposit accounts at 
New Haven Savings Bank will not result in the receipt of new funds for 
investment but will result in a reduction of New Haven Savings Bank’s deposits. 

We are undertaking the conversion and offering at this time primarily in order 
to provide the consideration for the acquisitions of Connecticut Bancshares and 
Alliance.  

The table below indicates the net proceeds to us based on the number of shares 
sold in the offering. In all cases except sales near the low end of the offering 
range, the proceeds will be sufficient to fund all conversion and acquisition 
expenses and the loan for the employee stock ownership plan. If sales of stock 
are near the low end of the range, we will borrow the funds necessary to fund 
the employee stock ownership plan from a third party lender. 

                 
        Minimum          Midpoint        Maximum     Maximum, As Adjusted 

--------------------------------------------------------------------------------
    
       (in thousands)     
Gross proceeds 
     $  658,750        $  775,000        $  891,250        $  1,024,938     
Conversion expenses 
        (9,317  )        (10,421  )        (11,526  )        (12,796  )  
       
--------------------------------------------------------------------------------
 
Net proceeds 
        649,433           764,579           879,724           1,012,142     
Less: 
                                                  
Cash for Acquisition of Connecticut Bancshares 
        (606,973  )        (606,973  )        (606,973  )    (606,973  )  
Cash for Acquisition of Alliance 
        (17,959  )        (17,959  )        (17,959  )        (17,959  )  
Employee Stock Ownership Plan (5%) 
            —             (40,750  )        (46,562  )        (53,246  )  
       
Cash/Excess 
       $  24,501        $  98,897        $  208,230        $  333,964     
       
  

The cash available at NewAlliance Bancshares, after paying the cash acquisition 
costs and lending funds to the employee stock ownership plan as shown above, 
would be used for general operating purposes. No specific uses are contemplated 
at this time. The additional funds available could be used as follows: 

   •     To lend funds to the employee stock ownership plan in order to permit 
it to purchase the additional 2% of the shares of common stock issued in the 
conversion in addition to the 5% purchased by it in the conversion;  

   •     To pay cash dividends to shareholders;  

   •     To repurchase shares of our common stock;  

   •     To invest in securities;  

   •     To finance the acquisition of financial institutions, branches or other 
financial services companies, although, except for the proposed acquisitions of 
Connecticut Bancshares and Alliance, we do not currently have any agreements or 
understandings regarding any specific acquisition transaction; and  

   •     for other general corporate purposes, including investment of 
additional funds in New Haven Savings Bank.  


Initially, a substantial portion of the remaining net proceeds will be invested 
in short-term investments, investment grade debt obligations and mortgage-backed 
securities. 

New Haven Savings Bank could use funds from the offering provided to it by 
NewAlliance Bancshares as follows: 

   •     to fund new loans, including single-family mortgage loans, multi-family 
residential and commercial mortgage loans, commercial business loans, 
construction loans and consumer loans;  

   •     to expand its retail banking franchise by establishing or acquiring 
new branches or other financial services companies, although, except for the 
proposed acquisitions of Savings Bank of Manchester and Tolland Bank, we do not 
now have any agreements or understandings regarding any acquisition 
transactions;  

   •     to enhance existing products and services and to support new products 
and services;  

   •     to invest in securities; and  

   •     for other general corporate purposes."
SANTARUS INC,https://www.nasdaq.com/markets/ipos/company/santarus-inc-407547-37040,https://www.nasdaq.com/markets/ipos/company/santarus-inc-407547-37040,424B1,4/1/2004,https://www.nasdaq.com/markets/ipos/filing.ashx?filingid=2871632,"We will receive approximately $48.3 million in net proceeds from the sale 
of our common stock in this offering, after deducting underwriting discounts 
and commissions and estimated offering expenses. If the underwriters exercise 
their over-allotment option in full, we estimate that our net proceeds will be 
approximately $55.9 million. 

      We expect to use a majority of the net proceeds of this offering to 
manufacture and market Rapinex powder-for-suspension 20mg, subject to receipt 
of regulatory approval, and to build our sales and marketing capabilities. 

      To a lesser extent, we anticipate using the remaining net proceeds of 
this offering: 

   
   •   for clinical trials, regulatory submissions and the further development 
and manufacture of our other product candidates and new product opportunities; 
and  
   
   •   for general corporate purposes.  


      In addition, we may use a portion of the net proceeds from this offering 
to acquire products, technologies or businesses that are complementary to our 
own, but we currently have no commitments or agreements relating to any of 
these types of transactions. 

      We believe that the net proceeds from this offering, together with our 
existing cash, cash equivalents and short-term investments, will be sufficient 
to meet our projected operating requirements for at least the next 12 months. 
We expect to satisfy our future cash needs through the sale of equity 
securities, debt financings, corporate collaborations and licensing 
arrangements. 

      As of the date of this prospectus, we cannot specify with certainty all 
of the particular uses for the net proceeds to be received upon the completion 
of this offering. The amount and timing of our expenditures will depend on 
several factors, including the progress of our clinical trials and 
commercialization efforts as well as the amount of cash used in our operations. 
Accordingly, our management will have broad discretion in the application of 
the net proceeds and investors will be relying on the judgment of our 
management regarding the application of the proceeds of this offering. We 
reserve the right to change the use of these proceeds as a result of certain 
contingencies such as the results of our commercialization efforts, competitive 
developments, opportunities to acquire products, technologies or businesses and 
other factors. 

      Pending the uses described above, we plan to invest the net proceeds of 
this offering in short- and medium-term, interest-bearing obligations, 
investment-grade instruments, certificates of deposit or direct or guaranteed 
obligations of the U.S. government."
"ALNYLAM PHARMACEUTICALS, INC.",https://www.nasdaq.com/markets/ipos/company/alnylam-pharmaceuticals-inc-375375-38031,https://www.nasdaq.com/markets/ipos/company/alnylam-pharmaceuticals-inc-375375-38031,424B4,5/28/2004,https://www.nasdaq.com/markets/ipos/filing.ashx?filingid=2994235,"We estimate that our net proceeds from the sale of 5,000,000 shares of
common stock in this offering will be approximately $26.0 million, based on an
initial public offering price of $6.00 per share, and after deducting the
estimated underwriting discounts and commissions and estimated offering expenses
payable by us. If the underwriters exercise their over-allotment option, we
estimate that we will receive additional net proceeds of approximately
$4.2 million. We expect to use the net proceeds to fund:

   •  research and development activities, including development of our RNAi      
      capabilities, selection of product candidates and preclinical and clinical  
      development of our product candidates;                                      
  
   •  acquisition, licensing and protection of intellectual property rights; and  
  
   •  working capital, capital expenditures and other general corporate purposes. 


      The amounts and timing of our actual expenditures will depend upon
numerous factors, including the status of our research and development efforts,
the timing and success of preclinical testing, the timing and success of any
clinical trials we may commence in the future, the timing of regulatory
submissions, the amount of proceeds actually raised in this offering, the amount
of cash generated by our operations, the amount of competition we face and how
successful we are with obtaining any required licenses and entering into
collaboration arrangements. We may also use a portion of the proceeds for the
acquisition of, or investment in, companies, technologies, products or assets
that complement our business. However, we have no present understandings,
commitments or agreements to enter into any potential acquisitions or
investments. We currently estimate that of the net proceeds from this offering
we will spend between $12 million and $15 million on our systemic RNAi research
and development activities, between $8 million and $10 million on our AMD and
other direct RNAi programs, and the remainder on the acquisition, licensing and
protection of intellectual property rights and on working capital, capital
expenditures and other general corporate purposes. Our management will have
broad discretion to allocate the net proceeds from this offering. We do not
expect the net proceeds from this offering to be sufficient to fund the
completion of the development of any product candidate and we expect to need to
raise additional funds prior to being able to market any product.

      Pending utilization of the net proceeds as described above, we intend to
invest the net proceeds of the offering in short-term investment grade and
U.S. government securities."
ANGIODYNAMICS INC,https://www.nasdaq.com/markets/ipos/company/angiodynamics-inc-625899-38139,https://www.nasdaq.com/markets/ipos/company/angiodynamics-inc-625899-38139,424B4,5/27/2004,https://www.nasdaq.com/markets/ipos/filing.ashx?filingid=2991219,"The net proceeds to us from the sale of 1,950,000 shares of common stock being
offered by us at an initial public offering of $11.00 per share, after deducting
the underwriting discounts and commissions and offering expenses, will be
approximately $18.6 million, or $21.6 million if our underwriters exercise their
over-allotment option in full. We intend to use the net proceeds of this
offering for working capital and general corporate purposes, including new
product development and potential acquisitions of complementary products and
businesses, and to repay debt of $3,000,000 to E-Z-EM. This debt, which we
originally incurred in 1997 and subsequently renewed, bears interest at an
annual rate of 1.50% and is payable on November 8, 2006. In the past we have
had, and in the future we may have, discussions regarding acquisitions of
complementary products and businesses.

 

Pending the application of the net proceeds, we intend to invest the net
proceeds in short-term, interest-bearing investment-grade securities."
CORNERSTONE THERAPEUTICS INC,https://www.nasdaq.com/markets/ipos/company/cornerstone-therapeutics-inc-155524-38406,https://www.nasdaq.com/markets/ipos/company/cornerstone-therapeutics-inc-155524-38406,424B1,5/27/2004,https://www.nasdaq.com/markets/ipos/filing.ashx?filingid=2991431,"We estimate that our net proceeds from the sale of 6,000,000 shares of
common stock in this offering will be approximately $37.4 million, based on the
initial public offering price of $7.00 per share, after deducting the
underwriting discounts and commissions and estimated offering expenses payable
by us. If the underwriters exercise their over-allotment option, we estimate
that we will receive additional net proceeds of approximately $5.9 million.

      We estimate that we will use:

   •  approximately $18.0 million of these net proceeds to fund the               
      commercialization of our product candidates, including establishing sales   
      and marketing capabilities and manufacturing and distribution arrangements  
      to launch Zyflo;                                                            
  
   •  approximately $17.0 million of these net proceeds to fund the preclinical   
      and clinical development of our existing product candidates;                
  
   •  approximately $2.0 million of these net proceeds to fund the discovery and  
      development of additional product candidates; and                           
  
   •  the remainder of these net proceeds to fund working capital, capital        
      expenditures and other general corporate purposes.                          


      The amounts and timing of our actual expenditures will depend upon
numerous factors, including the timing of the completion of clinical trials, the
timing of regulatory submissions and any terms or conditions imposed as a
condition of any approval of the controlled-release formulation of zileuton or
our other product candidates, the status of our product development and
commercialization efforts for all our programs, the amount of proceeds actually
raised in this offering, the amount of cash generated by our operations, the
amount of competition we face and how successful we are with sales and marketing
activities.

      We may also use a portion of the proceeds for the acquisition of, or
investment in, companies, technologies, products or assets that complement our
business. However, we have no present understandings, commitments or agreements
to enter into any potential acquisitions or investments. Furthermore, we have
not determined the amounts we plan to spend on any of the areas listed above or
the timing of these expenditures. As a result, our management will have broad
discretion to allocate these proceeds.

      We do not expect the net proceeds from this offering to be sufficient to
fund the completion of the development of our product candidates, other than
Zyflo, which, subject to regulatory approval, we expect to launch commercially
in the first half of 2005, and the controlled-release formulation of zileuton
for asthma, for which we anticipate submitting an NDA in 2005. We believe that
the net proceeds of this offering will be sufficient to complete the Phase I and
Phase II clinical trials of CTI-01 that we anticipate initiating in 2004. We
also believe the net proceeds of this offering will be sufficient to complete
the Phase I clinical trial of our intravenous formulation of zileuton and the
Phase II clinical trials of zileuton in COPD patients that we anticipate
initiating in 2004. The actual costs and timing of clinical trials and
associated activities to enable a regulatory submission, however, are highly
uncertain, subject to risk and will change depending upon the clinical
indication developed and the development strategy adopted. We also expect to
apply the proceeds of this offering to the development of product candidates
under our HMGB1 program and cholinergic anti-inflammatory program. However,
because these programs are still in the early stages of clinical development,
the actual costs and timing of research, preclinical development, clinical
trials and associated activities are highly uncertain, subject to risk and will
change depending upon the project chosen to be developed under the program, the
clinical indication developed and the development strategy adopted. We may need
to raise additional external funds prior to completing the development of our
product candidates other than Zyflo and the controlled-release formulation of
zileuton.

      Pending utilization of these proceeds, we intend to invest the net
proceeds of this offering in short-term investment grade and U.S. government
securities."
REPUBLIC AIRWAYS HOLDINGS INC,https://www.nasdaq.com/markets/ipos/company/republic-airways-holdings-inc-100424-26956,https://www.nasdaq.com/markets/ipos/company/republic-airways-holdings-inc-100424-26956,424B4,5/27/2004,https://www.nasdaq.com/markets/ipos/filing.ashx?filingid=2992035,"The net proceeds we will receive from the sale of the 5,000,000 shares
of common stock offered by us, at a public offering price of $13.00 per share,
and after deducting estimated underwriting discounts and offering expenses, are
estimated to be $57,950,000.

        We currently intend to use the net proceeds of the offering as follows:

        º approximately $19.1 million to repay all indebtedness to WexAir LLC,
          our majority stockholder; and

        º the remainder for general corporate purposes, including working
          capital and the acquisition of additional aircraft and related spare
          parts and support equipment, including pre-delivery aircraft deposits.

        Pending such utilization, we intend to invest the proceeds in
short-term, investment grade, interest-bearing securities.

        The indebtedness to be repaid to our majority stockholder was initially
incurred in May 1998 to finance a portion of the purchase price for Chautauqua.
The note, which currently bears interest at the annual rate of 7.5% compounded
semi-annually, currently matures on June 13, 2004."
SP PLUS CORP,https://www.nasdaq.com/markets/ipos/company/sp-plus-corp-50946-37693,https://www.nasdaq.com/markets/ipos/company/sp-plus-corp-50946-37693,424B1,5/27/2004,https://www.nasdaq.com/markets/ipos/filing.ashx?filingid=2993148,"We estimate that our net proceeds from the sale by us of shares of our
common stock will be approximately $45.2 million or approximately $46.9 million
if the underwriters exercise their over-allotment option in full, after
deducting the underwriting discount and estimated offering expenses. We also
intend to refinance our existing senior credit facility and enter into a
$90.0 million new senior credit facility (with approximately $9.1 million of
availability following this offering) which will mature in May 2007. We will not
receive any proceeds from the sale of shares, if any, by Steamboat
Industries LLC.

        We expect to use the net proceeds from this offering and a portion of
our new senior credit facility as follows:

        º $62.3 million to redeem or otherwise repurchase all of our 14% notes
          due 2006 at 104% of principal amount including accrued interest; and

        º $6.3 million to purchase all shares of our common stock held by our
          minority stockholders and an option to purchase common stock held by
          one minority stockholder, pursuant to a stockholders' agreement. 

        The amount needed to redeem or repurchase the 14% notes and to
repurchase all shares of our common stock held by our minority stockholders and
an option to purchase common stock held by one minority stockholder reflects a
March 31, 2004 closing. The notes accrue at 14% per year. The amounts due under
the stockholders' agreement accrete at 11.75% per year. An additional
$2.3 million would be needed to redeem or repurchase our 14% notes and meet our
obligations under the stockholders' agreement (assuming a June 30, 2004
closing), including accrued interest. Such additional funds would be financed
through borrowings under our new senior credit facility.

        We will also issue notes in an aggregate principal amount of
$5.0 million to the minority stockholders who are selling us common stock as
part of the purchase price. The minority stockholders have consented to the
assumption of this obligation by Steamboat Industries LLC and our release from
this obligation without recourse to us, which will be reflected as additional
paid-in capital in our financial statements.

        The amount and timing of the use of proceeds may vary depending upon a
number of factors, including but not limited to, the timing of the redemption of
the 14% notes. Until we use the proceeds of this offering for the above
purposes, we intend to reduce borrowings under our proposed new senior credit
facility or invest the funds in short-term, investment-grade, interest-bearing
securities."
ACADIA PHARMACEUTICALS INC,https://www.nasdaq.com/markets/ipos/company/acadia-pharmaceuticals-inc-81806-38010,https://www.nasdaq.com/markets/ipos/company/acadia-pharmaceuticals-inc-81806-38010,424B4,5/27/2004,https://www.nasdaq.com/markets/ipos/filing.ashx?filingid=2993535,"We estimate that the net proceeds from the sale of 5,000,000 shares of our
common stock in this offering will be approximately $31.3 million, or
approximately $36.1 million if the underwriters’ over-allotment option is
exercised in full, after deducting underwriting discounts and commissions and
our estimated offering expenses.

 

We intend to use approximately $30 million of the net proceeds from this
offering to fund research and development activities, including clinical trials,
and preclinical development and research expenses. In particular, we anticipate
that a substantial portion of this $30 million will be used to complete our
planned Phase II clinical trials in each of our three internal development
programs, ACP-103 for treatment-induced dysfunction in Parkinson’s disease and
ACP-104 and ACP-103 for schizophrenia. However, due to the risks inherent in the
clinical trial process and given the early stage of development of our programs,
we are unable to estimate with any certainty the total costs we will incur in
the continued development of our drug candidates for potential
commercialization. Due to these same factors, we are unable to determine the
anticipated completion dates for our research and development programs. In
addition, we cannot forecast with any degree of certainty which drug candidates
will be subject to future collaborative or licensing arrangements, when such
arrangements will be secured, if at all, and to what degree such arrangements
would affect our development plans and capital requirements.

 

We anticipate using the remaining balance of the net proceeds for working
capital and general corporate purposes. In particular, we expect to allocate the
balance of the net proceeds as follows: 30% for increased general and
administrative expenses, 25% for increased costs associated with potential
further expansion of our employee base and facilities, 15% for additional
equipment purchases, and 30% for miscellaneous working capital and general
corporate purposes. These expenditures are expected to include the hiring of
additional research and development staff and chemists, the relocation and
expansion of our facility near Copenhagen, and the purchase of robotics and
other laboratory equipment for our research and development activities.

 

We may also use a portion of the net proceeds to acquire or invest in
complementary businesses or products or to obtain the right to use complementary
technologies or products. To the degree that we pursue any of these
transactions, the amount of proceeds that we have available for working capital
and general corporate purposes may decrease. We have no present plans or
commitments relating to any of these types of transactions and are not currently
engaged in any negotiations with respect to any of these transactions.

 

The amounts and timing of our actual expenditures will depend significantly upon
a number of factors, including the amount and timing of revenues from our
current or future collaborations and the progress in, and costs of, our clinical
and preclinical drug programs. Pending the use of the net proceeds from this
offering, we intend to invest these funds in short-term, interest-bearing
investment-grade securities."
GENWORTH FINANCIAL INC,https://www.nasdaq.com/markets/ipos/company/genworth-financial-inc-615960-37338,https://www.nasdaq.com/markets/ipos/company/genworth-financial-inc-615960-37338,424B1,5/25/2004,https://www.nasdaq.com/markets/ipos/filing.ashx?filingid=2986615,"We will not receive any proceeds from the sale by the selling
stockholder of Class A Common Stock in this offering or of the Equity Units or
Series A Preferred Stock in the concurrent offerings."
