"SPIRIT REALTY CAPITAL, INC.",https://www.nasdaq.com/markets/ipos/company/spirit-realty-capital-inc-617470-68594,https://www.nasdaq.com/markets/ipos/company/spirit-realty-capital-inc-617470-68594,424B4,9/21/2012,https://www.nasdaq.com/markets/ipos/filing.ashx?filingid=8831942,"We estimate that the net proceeds to us from this offering will be 
approximately $394.6 million, or $455.2 million if the underwriters exercise 
their over-allotment option in full, after deducting underwriting discounts and
commissions and other estimated expenses. 

We intend to use the net proceeds from this offering plus available cash to 
repay our outstanding $399 million TLB, which matures in August 2013. The TLB 
requires interest payments based on either (1) LIBOR in effect at the beginning
of each interest period plus a spread of 3% or (2) a base rate as defined in 
the loan agreement. As of June 30, 2012, the rate on the TLB was 3.78%, based 
on a 6-month LIBOR rate of 0.78% effective beginning on February 1, 2012. On 
August 1, 2012, the rate on the TLB was reset to 3.44%, based on a 3-month 
LIBOR rate of 0.44%, which will remain in effect until November 1, 2012. 

We intend to use the net proceeds from this offering plus available cash to pay
$15.6 million of estimated costs and expenses associated with securing lenders’
consents to this offering and the secured revolving credit facility we expect 
to enter into upon the completion of this offering. Any remaining net proceeds 
will be used for general business and working capital purposes, including 
potential future acquisitions. 

To the extent the net proceeds from this offering are insufficient to satisfy 
all of the uses described above, we intend to meet any required cash needs with
cash on hand, net cash from operating activities and borrowings under the $100 
million secured revolving credit facility that we expect to have upon the 
completion of this offering. 

Pending the permanent use of the net proceeds from this offering, we intend to 
invest the net proceeds in interest-bearing, short-term investment-grade 
securities, money-market accounts or other investments that are consistent with
our intention to maintain our qualification as a REIT for federal income tax 
purposes."
SUNOCO LP,https://www.nasdaq.com/markets/ipos/company/sunoco-lp-884445-70181,https://www.nasdaq.com/markets/ipos/company/sunoco-lp-884445-70181,424B4,9/21/2012,https://www.nasdaq.com/markets/ipos/filing.ashx?filingid=8832507,"We intend to use the net proceeds of approximately $178.8 million from this 
offering, based upon the initial public offering price of $20.50 per common 
unit, after deducting underwriting discounts, structuring fees and offering 
expenses, to: 

• distribute $25.4 million to SHC as reimbursement of certain capital
  expenditures incurred with respect to the assets contributed to us in
  connection with this offering; and 

• purchase approximately $153.4 million of U.S. Treasury or other investment
  grade securities, which will be assigned as collateral to secure a new $153.4
  million term loan that will be fully guaranteed by SHC. The proceeds of such
  term loan will be used to make a $153.4 million distribution to SHC to
  finance in part our acquisition of the assets transferred by SHC to us in
  connection with this offering. In addition, we will draw $2.4 million in
  borrowings under our revolving credit facility in order to pay our
  transaction expenses associated with entering into the term loan and the
  revolving credit facility. 

If and to the extent the underwriters exercise their option to purchase 
additional common units, the number of additional common units purchased by 
the underwriters pursuant to such exercise will be issued to the public and 
the remainder of the additional common units, if any, will be issued to SHC 
or a wholly owned subsidiary of SHC. Any such units issued to SHC or a wholly 
owned subsidiary of SHC will be issued for no additional consideration. 
Accordingly, the exercise of the underwriters' option will not affect the 
total number of common units outstanding or the amount of cash needed to pay 
the minimum quarterly distribution on all units. If the underwriters exercise 
their option to purchase additional common units in full, the additional net 
proceeds would be approximately $27.3 million. The net proceeds received in 
connection with any exercise of such option will be used to purchase 
a corresponding amount of additional U.S. Treasury or other investment grade 
securities, which will be assigned as collateral to secure additional term 
loan borrowings in the amount of such net proceeds, which will be fully 
guaranteed by SHC. The proceeds of such additional term loan borrowings will 
be used to make an additional distribution to SHC."
"TRULIA, INC.",https://www.nasdaq.com/markets/ipos/company/trulia-inc-695941-70564,https://www.nasdaq.com/markets/ipos/company/trulia-inc-695941-70564,424B4,9/20/2012,https://www.nasdaq.com/markets/ipos/filing.ashx?filingid=8830178,"The net proceeds to us from the sale of shares of our common stock that we are 
selling in this offering will be approximately $75.1 million, based upon the 
initial public offering price of $17.00 per share, and after deducting 
underwriting discounts and commissions and estimated offering expenses payable 
by us. If the underwriters’ option to purchase additional shares from us is 
exercised in full, our net proceeds would be approximately $89.3 million, after
deducting underwriting discounts and commissions and estimated offering 
expenses payable by us. We will not receive any proceeds from the sale of 
shares of our common stock by the selling stockholders. 

The principal purposes of this offering are to increase our financial 
flexibility, create a public market for our common stock, and facilitate our 
future access to the public equity markets. 

We currently intend to use the net proceeds that we will receive from this 
offering for working capital and other general corporate purposes. We may also 
use a portion of the net proceeds that we receive to acquire or invest in 
complementary businesses, products, services, technologies, or other assets. 
We have not entered into any agreements or commitments with respect to any 
acquisitions or investments at this time. 

We cannot specify with certainty the particular uses of the net proceeds that 
we will receive from this offering. Accordingly, we will have broad discretion 
in using these proceeds. Pending the use of proceeds from this offering as 
described above, we plan to invest the net proceeds that we receive in this 
offering in short-term and intermediate-term interest-bearing obligations, 
investment-grade investments, certificates of deposit, or direct or guaranteed 
obligations of the U.S. government."
"ENDEAVOR IP, INC.",https://www.nasdaq.com/markets/ipos/company/endeavor-ip-inc-848986-66453,https://www.nasdaq.com/markets/ipos/company/endeavor-ip-inc-848986-66453,424B3,1/4/2013,https://www.nasdaq.com/markets/ipos/filing.ashx?filingid=9004115,"We will not receive any of the proceeds from the sale of shares of the common 
stock offered by the selling stockholders. We are registering 3,000,000 of our 
9,000,000 currently outstanding shares of common stock for resale to provide 
the holders thereof with freely tradable securities, but the registration of 
such shares does not necessarily mean that any of such shares will be offered 
or sold by the holders thereof."
