"MELINTA THERAPEUTICS, INC. /NEW/",https://www.nasdaq.com/markets/ipos/company/melinta-therapeutics-inc-new-805275-68346,https://www.nasdaq.com/markets/ipos/company/melinta-therapeutics-inc-new-805275-68346,424B4,2/3/2012,https://www.nasdaq.com/markets/ipos/filing.ashx?filingid=8376357,"We estimate that the net proceeds from the sale of the shares of common stock 
we are offering will be approximately $46.3 million, based on the initial 
public offering price of $6.00 per share, and after deducting the estimated 
underwriting discounts and commissions and estimated offering costs payable 
by us. If the underwriters exercise in full their over-allotment option, we 
estimate that our net proceeds from this offering will be approximately $53.4 
million. 

The principal purposes of this offering are to obtain additional capital to 
support our operations, to create a public market for our common stock and to 
facilitate our future access to the public equity markets. We expect to use 
the net proceeds of this offering for the following purposes: 

•     $22.0 million to conduct and complete our planned Phase 3 trial for the
 oral formulation of CEM-101; 
 
•     $4.0 million to complete our ongoing Phase 1 trial for the IV
 formulation of CEM-101; 
 
•     $3.0 million to fund formulation and manufacturing of drug product; 
 
•     $4.0 million to fund our planned Phase 2 trial for Taksta for the
 treatment of prosthetic joint infections; and 
 
•     the remainder for working capital and other general corporate purposes,
 including for additional costs and expenses associated with being a public
 company. 
 
To support our planned NDA for the oral and IV formulations of CEM-101 for 
the treatment of CABP, we estimate that we will need approximately $9.2 
million to conduct a number of studies to support FDA approval of CEM-101, 
including a thorough QT, or TQT, study to look at cardiac effects, and 
studies in patients with hepatic insufficiency and approximately $3.6 million 
to acquire the API for our planned Phase 3 trials for the IV formulation of 
CEM-101. Based on the approximately $46.3 million in net proceeds from this 
offering, we will need to raise additional capital for those activities. 

The amounts and timing of our actual expenditures will depend upon numerous 
factors, including the ongoing status and results of the CEM-101 and Taksta 
clinical trials. We believe that the net proceeds from this offering and our 
existing cash and equivalents, together with interest thereon and our 
expected draw of the $10.0 million available under the Hercules loan, will 
be sufficient to fund our operations into 2014. 

Pending their use, we plan to invest the net proceeds from this offering in 
short- and intermediate-term, interest-bearing obligations, investment-grade 
instruments, certificates of deposit or direct or guaranteed obligations of 
the U.S. government."
AVG TECHNOLOGIES N.V.,https://www.nasdaq.com/markets/ipos/company/avg-technologies-nv-871866-69026,https://www.nasdaq.com/markets/ipos/company/avg-technologies-nv-871866-69026,424B4,2/2/2012,https://www.nasdaq.com/markets/ipos/filing.ashx?filingid=8371991,"We estimate that we will receive net proceeds of approximately $50.0 million 
from the sale of 4,000,000 ordinary shares in this offering, after deducting 
the underwriting discounts and commissions and estimated offering expenses 
payable by us. 

We intend to use the proceeds of this offering for general corporate purposes,
including, without limitation, investments in property and equipment and 
intangible assets. We may also use a portion of the net proceeds for the 
acquisition of, or investment in, technologies, teams or businesses that 
complement our business, although we have no present commitments or agreements
to enter into any material acquisitions or make any such material investments.
We have no specific plans or commitments with respect to the proceeds to us 
from this offering and therefore are unable to quantify the allocation of 
such proceeds among various potential uses at this time. Our management will
have significant flexibility and discretion in applying the net proceeds of 
this offering. 

We will not receive any proceeds from the sale by the selling shareholders in 
this offering, the net proceeds of which will be received by the selling 
shareholders, or from the sale by certain of the selling shareholders of the 
over-allotment shares upon an exercise (if any) of the over-allotment option,
the net proceeds of which will be received by the selling shareholders. The 
selling shareholders will include certain entities affiliated with or 
controlled by members of our supervisory board."
GREENWAY MEDICAL TECHNOLOGIES INC,https://www.nasdaq.com/markets/ipos/company/greenway-medical-technologies-inc-99155-67687,https://www.nasdaq.com/markets/ipos/company/greenway-medical-technologies-inc-99155-67687,424B4,2/2/2012,https://www.nasdaq.com/markets/ipos/filing.ashx?filingid=8372496,"We estimate that our net proceeds from the sale of the shares of common stock 
by us will be approximately $47.9 million after deducting the estimated 
underwriting discounts and commissions and estimated offering expenses payable 
by us. If the underwriters exercise their over-allotment option in full, the 
net proceeds to us will be approximately $57.2 million. We will not receive 
any of the proceeds from the sale of shares by the selling stockholders. 

We intend to use the net proceeds of this offering to pay (a) $23.3 million 
consisting of a cash payment to holders of our outstanding preferred stock 
concurrently with the conversion of such shares into shares of common stock 
upon the closing of this offering (excluding those holders who have elected 
in connection with the conversion to receive all or a portion of such payment 
in the form of common stock), (b) approximately $12 million to finance the 
construction of new facilities to accommodate the growth of our business, 
and (c) the remainder for working capital and general corporate purposes, 
which may include financing our growth, developing new technology solutions 
and services, and funding capital expenditures, acquisitions and investments. 
The Company currently does not have any pending material acquisitions. We will 
not receive any proceeds from the sale of shares by the selling stockholders. 

In connection with the Reincorporation and consummation of this offering, all 
outstanding shares of Series A and Series B Convertible Preferred Stock will 
be converted into shares of common stock. Each share of Series A Preferred 
Stock will convert into 1.263 shares of the Company’s common stock, while 
each share of Series B Preferred Stock will convert into one share of the 
Company’s common stock. In connection with such conversion, each Series A 
Preferred stockholder will receive a payment of $6 per preferred share and 
each Series B Preferred stockholder will receive $4.75 per preferred share, 
which holders of Series A Preferred Stock and Series B Preferred Stock may 
elect to receive in the form of shares of the Company’s common stock in an 
amount equal to the quotient obtained by the dividing (i) the total amount 
of the payment then due to such holder of Preferred Stock by (ii) the per 
share price of the Company’s common stock based on the initial price to the 
public in this offering. Accordingly, consistent with payment elections 
previously received by the Company, the holders of our Series A and Series 
B Convertible Preferred Stock will receive cash payments totaling $23.3 
million as well as a total of 1,870,124 of common shares. Upon consummation 
of the Reincorporation and the closing of this offering, we will no longer 
have any preferred stock outstanding. 

Pending the foregoing uses, we intend to invest the net proceeds in 
high-quality, investment grade U.S. government-backed obligations. The 
actual use of the proceeds may vary significantly and will depend on a 
number of factors, including our future revenue and cash generated by 
operations and other factors. Accordingly, our management will have broad 
discretion in applying the net proceeds of this offering."
MATADOR RESOURCES CO,https://www.nasdaq.com/markets/ipos/company/matador-resources-co-861962-67914,https://www.nasdaq.com/markets/ipos/company/matador-resources-co-861962-67914,424B4,2/2/2012,https://www.nasdaq.com/markets/ipos/filing.ashx?filingid=8372510,"We will receive net proceeds of approximately $127.6 million from the sale of 
the common stock offered by us after deducting estimated expenses of 
approximately $3.0 million and estimated underwriting discounts and commissions
of approximately $9.4 million. If the underwriters’ over-allotment option is 
exercised in full, we estimate that our net proceeds will be approximately 
$135.4 million. We will not receive any proceeds from the sale of shares of our
common stock by the selling shareholders, including with respect to any sale of
shares by the selling shareholders as a result of the exercise of the 
underwriters’ over-allotment option. 

Initially, we intend to use the net proceeds we receive from this offering to 
repay the then outstanding borrowings under our credit agreement ($123.0 
million outstanding at January 27, 2012, excluding outstanding letters of 
credit). Following the application of the net proceeds we receive from this 
offering, we will have approximately $98.7 million available for potential 
future borrowings under our credit agreement (after giving effect to 
outstanding letters of credit). We intend to use the remaining net proceeds 
from this offering, our cash from operations and available borrowings under our
credit agreement to fund our 2012 capital expenditure requirements. As a result
of our anticipated increases in production and reserves, we expect to have a 
sufficient increase in our cash flows from operations during the year ending 
December 31, 2012, as compared to our cash flows from operations in prior 
periods, as well as a sufficient increase in the borrowing base under our 
credit agreement to help fund our 2012 capital expenditure budget. A majority 
of our anticipated increase in cash flows during the year ending December 31, 
2012 is expected to come from our exploration activities on unproved properties
at September 30, 2011 in the Eagle Ford shale play assuming such exploration 
activities are successful. These anticipated increases in our cash flows from 
operations are based upon current oil and natural gas prices and the hedges we 
currently have in place. If our exploration activities result in less cash 
flows than anticipated, we may seek additional sources of capital, including 
through borrowings under our credit agreement (assuming availability under our 
borrowing base) or from the issuance of additional equity or debt securities. 
In addition, we may modify our planned capital expenditure budget for 2012 
accordingly. Exploration activities are subject to a number of risks and 
uncertainties that could impact our ability to sufficiently increase our 
reserves, cash flows from operations and borrowing base under our credit 
agreement. Although we have no current plans or proposals, pending application 
of the portion of our net proceeds to fund our 2012 capital expenditure 
requirements, we may be presented with other opportunities for acquisitions of 
interests or acreage. In that case, we may decide to use a portion of the net 
proceeds to finance these acquisitions and use cash flows from operations or 
additional borrowings under our credit agreement to fund our 2012 capital 
expenditure requirements, when necessary. 

We intend to use the following amounts of the net proceeds for the above uses: 

Use of Net Proceeds                                                Amount 
                                                                (in millions) 
Repayment of senior secured revolving credit agreement             $  123.0  
Payment of a portion of 2012 capital expenditure requirements           4.6 
       
Total net proceeds                                                 $  127.6

In December 2011, we amended and restated our senior secured revolving credit 
agreement. This amendment increased the maximum facility amount from $150 
million to $400 million. Borrowings are limited to the lesser of $400 million 
or the borrowing base, which will be $100 million immediately following this 
offering. Comerica Bank serves as administrative agent of our credit agreement,
which matures in December 2016. At January 27, 2012, all borrowings under our 
credit agreement bore interest at a variable rate of 3.25% plus a Eurodollar-
based rate per annum, which equated to approximately 3.5% per annum. Affiliates
of certain of the underwriters are lenders under our senior secured revolving 
credit agreement and, accordingly, will receive a portion of the proceeds from 
this offering. 

Borrowings under the credit agreement were incurred from December 2010 through 
January 2012 to finance acquisitions of acreage and ongoing drilling and 
completion operations. Upon consummation of this offering and application of 
the net proceeds we receive in the manner described above, we will have 
available borrowings under our credit agreement to finance our capital 
expenditure requirements. We anticipate that we may need to access future 
borrowings under our credit agreement within 30 days following completion of 
this offering to fund a portion of our 2012 capital expenditure requirements 
in excess of amounts available from our cash flows and the net proceeds of this
offering. 

The selling shareholders will receive net proceeds of approximately $18.8 
million from their sale of 1,666,667 shares of common stock in this offering, 
or approximately $33.4 million if the underwriters exercise their over-
allotment option in full, and in each case after deducting estimated 
underwriting discounts and commissions. We will pay all expenses related to 
this offering, other than underwriting discounts and commissions related to the
shares sold by the selling shareholders. Certain selling shareholders that are 
selling 243,460 shares in this offering will not be required to pay 
underwriting discounts or commissions. 

While we expect to use the net proceeds from this offering in the manner 
described above, including for potential acquisitions of interests and/or 
acreage (although we have no current plans to do so), the ultimate amount of 
capital we will expend may fluctuate materially based on market conditions and 
our drilling results. Our future financial condition and liquidity will be 
impacted by, among other factors, our level of production of oil and natural 
gas and the prices we receive from the sale thereof, the outcome of our 
exploration and drilling programs, the number of commercially viable oil and 
natural gas discoveries made and the quantities of oil and natural gas 
discovered, the speed with which we can bring such discoveries to production, 
and the actual cost of exploration and development of our oil and natural gas 
assets. We intend to invest any net proceeds from this offering that exceed the
pay off amount of our credit agreement as described above in U.S. treasury 
bonds or investment grade instruments until otherwise needed."
"U.S. SILICA HOLDINGS, INC.",https://www.nasdaq.com/markets/ipos/company/us-silica-holdings-inc-860113-67694,https://www.nasdaq.com/markets/ipos/company/us-silica-holdings-inc-860113-67694,424B4,2/1/2012,https://www.nasdaq.com/markets/ipos/filing.ashx?filingid=8368617,"We will receive net proceeds from this offering of approximately $42.5 million,
after deducting underwriting discounts and commissions and estimated offering 
expenses payable by us. We will not receive any proceeds from the sale of 
shares of our common stock by the selling stockholders, including any shares 
sold by our parent LLC in connection with the exercise of the underwriters’ 
option to purchase additional shares. 

We intend to use the net proceeds of approximately $42.5 million from the sale 
of common stock by us in this offering to make an $8.0 million payment to 
terminate the Advisory Agreement entered into in connection with the Golden 
Gate Acquisition and to provide approximately $34.5 million to fund future 
capital expenditures for our business, including the construction of our new 
resin-coating facility described elsewhere in this prospectus. The other 
principal purposes for this offering are to create a public market for our 
common stock, facilitate our future access to the public equity markets, 
provide liquidity for our parent LLC and increase our visibility in our 
markets. Our management will have broad discretion over the uses of the net 
proceeds from this offering and reserves the right to change the use of 
proceeds. Pending application of the net proceeds as described above, we intend
to invest the net proceeds in short-term, investment-grade, interest-bearing 
securities."
"ENPHASE ENERGY, INC.",https://www.nasdaq.com/markets/ipos/company/enphase-energy-inc-804337-67429,https://www.nasdaq.com/markets/ipos/company/enphase-energy-inc-804337-67429,424B4,3/30/2012,https://www.nasdaq.com/markets/ipos/filing.ashx?filingid=8514805,"We estimate that the net proceeds from our sale of shares of 8,969,697 common 
stock in this offering at the initial public offering price of $6.00 per 
share, after deducting underwriting discounts and commissions and estimated 
offering expenses, will be approximately $47.4 million, or $54.9 million if 
the underwriters’ option to purchase additional shares is exercised in full. 

The principal reasons for this offering are to increase our capitalization 
and financial flexibility, increase our visibility in the marketplace and 
create a public market for our common stock. As of the date of this 
prospectus, we have no current specific plans for the use for the net proceeds
of this offering, or a significant portion thereof. We currently intend to 
use the net proceeds of this offering primarily for general corporate 
purposes. Overall, our management will have broad discretion in the 
application of our net proceeds from this offering, and investors will be 
relying on the judgment of our management regarding the application of these 
proceeds. Pending their use, we plan to invest the net proceeds from this 
offering in short term, interest bearing obligations, investment grade 
instruments, certificates of deposit or direct or guaranteed obligations of 
the U.S. government."
GASLOG LTD.,https://www.nasdaq.com/markets/ipos/company/gaslog-ltd-872099-69045,https://www.nasdaq.com/markets/ipos/company/gaslog-ltd-872099-69045,424B4,4/2/2012,https://www.nasdaq.com/markets/ipos/filing.ashx?filingid=8522795,"We estimate that the net proceeds to us from this offering and the concurrent 
private placement will be approximately $309.82 million after deducting 
underwriting discounts and commissions and estimated offering expenses payable 
by us, based on the initial public offering price of $14.00 per share. We 
intend to use the net proceeds of this offering and the concurrent private 
placement, together with our $1.13 billion of committed debt financing, to fund
the remaining scheduled installment payments totaling $1.42 billion under our 
eight new LNG carrier construction contracts. We intend to use the remaining 
proceeds of this offering and the concurrent private placement, if any, for 
other general corporate purposes."
MERRIMACK PHARMACEUTICALS INC,https://www.nasdaq.com/markets/ipos/company/merrimack-pharmaceuticals-inc-615489-67626,https://www.nasdaq.com/markets/ipos/company/merrimack-pharmaceuticals-inc-615489-67626,424B4,3/29/2012,https://www.nasdaq.com/markets/ipos/filing.ashx?filingid=8512682,"We estimate that the net proceeds from our issuance and sale of 14,300,000 
shares of our common stock in this offering will be approximately $93.5 
million, based on the initial public offering price of $7.00 per share, 
after deducting underwriting discounts and commissions and estimated 
offering expenses payable by us but prior to the payment of accrued dividends 
on our series B convertible preferred stock. If the underwriters exercise 
their over-allotment option in full, we estimate that the net proceeds from 
this offering will be approximately $107.5 million. 

As of December 31, 2011, we had cash and cash equivalents of approximately 
$50.5 million. We will use approximately $4.3 million of the net proceeds 
from this offering to pay accrued dividends on our series B convertible 
preferred stock. We currently estimate that we will use the balance of the 
net proceeds from this offering, together with our cash and cash equivalents 
as of December 31, 2011, as follows: 

. approximately $30.0 million to $40.0 million to fund our ongoing clinical 
program for MM-398, including approximately $12.0 million to $16.0 million of 
external costs for our Phase 3 clinical trial in metastatic pancreatic cancer, 
and to seek marketing approval and begin commercialization activities for 
MM-398 in the United States; 

• approximately $16.0 million to $22.0 million to fund our ongoing clinical 
program for MM-111; 

• approximately $14.0 million to $18.0 million to fund our ongoing clinical 
program for MM-302; 

• approximately $11.0 million to $15.0 million to fund our ongoing clinical 
program for MM-151; 

• approximately $30.0 million to $45.0 million to fund other research and 
development efforts, including beginning human clinical trials for new 
compounds; and 

• the balance, if any, to fund working capital, capital expenditures and 
other general corporate purposes, which may include the acquisition or 
licensing of other products, businesses or technologies. 

This expected use of the net proceeds from this offering and our existing 
cash and cash equivalents represents our intentions based upon our current 
plans and business conditions. The amounts and timing of our actual 
expenditures may vary significantly depending on numerous factors, including 
the progress of our development and commercialization efforts, the status of 
and results from clinical trials, as well as any collaborations that we may 
enter into with third parties for our product candidates, and any unforeseen 
cash needs. As a result, our management will retain broad discretion over the 
allocation of the net proceeds from this offering. We have no current 
understandings, agreements or commitments for any material acquisitions or 
licenses of any products, businesses or technologies. 

Based on our planned use of the net proceeds from this offering and our
existing cash and cash equivalents described above, we expect that such funds 
will be sufficient to enable us to complete enrollment in the Phase 3 clinical 
trial of MM-398 in metastatic pancreatic cancer. 

However, it is possible that we will not achieve the progress that we expect 
because the actual costs and timing of development, particularly clinical 
trials, are difficult to predict, subject to substantial risks and delays 
and often vary depending on the particular indication and development 
strategy. Sanofi is responsible for all development and manufacturing costs 
under our collaboration for the development and commercialization of MM-121. 
We do not expect that the net proceeds from this offering and our existing 
cash and cash equivalents will be sufficient to enable us to fund the
completion of development of any of our product candidates. 

Pending our use of the net proceeds from this offering, we intend to invest 
the net proceeds in a variety of capital preservation investments, including 
short-term, investment grade, interest bearing instruments and U.S. government 
securities."
