AZTECA ACQUISITION CORP,https://www.nasdaq.com/markets/ipos/company/azteca-acquisition-corp-853497-66933,https://www.nasdaq.com/markets/ipos/company/azteca-acquisition-corp-853497-66933,424B4,7/1/2011,https://www.nasdaq.com/markets/ipos/filing.ashx?filingid=8021857,"We are offering 10,000,000 units at an offering price of $10.00 per unit. We 
estimate that the net proceeds of this offering together with the funds we will
receive from the sale of the sponsor warrants (all of which will be deposited 
into the trust account) will be used as set forth in the following table. 

                                                     Without        With 
                                                     Over-          Over-
                                                     Allotment      Allotment 
                                                     Option         Option

Gross Proceeds 
                           
Gross Proceeds from units offered to public (1)   $ 100,000,000  $ 115,000,000
Gross proceeds from sponsor warrants offered 
in private placement                                  3,500,000      3,500,000
Total gross proceeds                              $ 103,500,000  $ 118,500,000
Offering expenses (2) 
                           
Underwriting commissions (1.75% of gross proceeds 
from units offered to public, excluding 
deferred portion) (3)                             $   1,750,000  $   2,012,500
Legal fees and expenses                                 270,000        270,000
Printing and engraving expenses                          45,000         45,000
Accounting fees and expenses                             50,000         50,000
Blue sky filing fees                                     40,000         40,000
SEC Fees                                                 13,352         13,352
FINRA Fees                                               12,000         12,000
Roadshow expenses                                        50,000         50,000
Miscellaneous                                           144,648        144,648
Total Offering Expenses (other than underwriting 
commissions)                                      $     625,000  $     625,000
Proceeds after Offering Expenses                    101,125,000    115,862,500
Held in Trust Account                             $ 100,500,000  $ 115,237,500
% of public offering price                               100.5%         100.2%
Not held in Trust                                 $     625,000  $     625,000

The following table shows the use of the $625,000 of net proceeds not held in 
the trust account and all of the interest earned on our trust account (net of 
taxes payable) that may be released to us to cover operating expenses, 
currently anticipated to be approximately $420,000 (4) . 

Use of Net Proceeds not Held in Trust                               Percentage

Legal, accounting, due diligence, travel, and 
other expenses in connection with any business 
combination                                           $    510,000    48.8  %
Legal and accounting fees related to regulatory 
reporting obligations                                      150,000    14.4  %
Payment for office space, administrative and support 
services                                                   210,000    20.0  %
Directors’ and officers’ insurance                         100,000     9.6  %
Working capital to cover miscellaneous expenses             75,000     7.2  %
Total                                                 $  1,045,000   100.0  %

 (1)  Includes amounts payable to public stockholders who properly redeem their
      shares in connection with our consummation of our initial business 
      combination.  

 (2)  A portion of the offering expenses have been paid from the proceeds of a 
      $100,000 loan from Azteca Acquisition Holdings, LLC, our sponsor. This 
      loan will be repaid upon consummation of this offering out of the 
      $625,000 of offering proceeds that has been allocated for the payment of 
      offering expenses other than underwriting commissions. In the event that 
      offering expenses are less than set forth in this table, any such amounts
      will be used for post-closing working capital expenses.  

 (3)  The underwriters have agreed to defer $3,750,000 of their underwriting 
      commissions (or $4,312,500 if the underwriters’ over-allotment option is 
      exercised in full), which equals 3.75% of the gross proceeds from the 
      units offered to the public, until consummation of initial business 
      combination. Upon consummation of our initial business combination, 
      $3,750,000, which constitutes the underwriters’ deferred commissions (or 
      $4,312,500 if the underwriters’ over-allotment option is exercised in 
      full) will be paid to the underwriters from the funds held in the trust 
      account, and the remaining funds will be released to us.  

 (4)  These expenses are estimates only. Our actual expenditures for some or 
      all of these items may differ from the estimates set forth herein. For 
      example, we may incur greater legal and accounting expenses than our 
      current estimates in connection with negotiating and structuring our 
      initial business combination based upon the level of complexity of such 
      business combination. In the event we identify an acquisition target in 
      a specific industry subject to specific regulations, we may incur 
      additional expenses associated with legal due diligence and the 
      engagement of special legal counsel. In addition, our staffing needs may 
      vary and as a result, we may engage a number of consultants to assist 
      with legal and financial due diligence. We do not anticipate any change 
      in our intended use of proceeds, other than fluctuations among the 
      current categories of allocated expenses, which fluctuations, to the 
      extent they exceed current estimates for any specific category of 
      expenses, would not be available for our expenses. Based on the current 
      interest rate environment, we anticipate that approximately $420,000 
      (after payment of taxes on such interest income) will be available to us 
      from interest income to be earned on the funds held in the trust account.
      The interest rate used to calculate the $420,000 of interest was 
      calculated using an assumed annual interest rate of approximately 0.25% 
      on the trust account over 21 months.  

A total of $100,500,000 (or $115,237,500 if the underwriters’ over-allotment 
option is exercised in full) of the net proceeds from this offering and the 
sale of the sponsor warrants described in this prospectus, including $3,750,000
(or $4,312,500 if the underwriters’ over-allotment option is exercised in full)
of deferred underwriting commissions, will be placed in a trust account in the 
United States with Continental Stock Transfer & Trust Company acting as trustee
and will be invested only in U.S. government treasury bills with a maturity of 
180 days or less or in money market funds meeting certain conditions under Rule
2a-7 under the Investment Company Act and that invest solely in U.S. 
Treasuries. Except for the interest income that may be released to us (net of 
taxes payable) to fund our working capital requirements, as discussed below, 
and any amounts necessary to purchase up to 15% of our public shares if we seek
stockholder approval of our business combination as will be permitted under the
investment management trust agreement to be entered into between us and 
Continental Stock Transfer & Trust Company, none of the funds held in the trust
account will be released from the trust account until the earlier of: (i) the 
consummation of our initial business combination within 21 months from the 
closing of this offering and (ii) a redemption to public stockholders prior to 
any voluntary winding-up in the event we do not consummate our initial business
combination within the applicable period. 

The net proceeds held in the trust account may be used as consideration to pay 
the sellers of a target business with which we ultimately complete our initial 
business combination. If our initial business combination is paid for using 
shares or debt securities, or not all of the funds released from the trust 
account are used for payment of the purchase price in connection with our 
business combination, we may apply the cash released from the trust account 
that is not applied to the purchase price for general corporate purposes, 
including for maintenance or expansion of operations of acquired businesses, 
the payment of principal or interest due on indebtedness incurred in 
consummating the initial business combination, to fund the purchase of other 
companies or for working capital. Although we believe that the net proceeds of 
this offering, including the interest earned on the proceeds held in the trust 
account that may be available to us for our initial business combination, will 
be sufficient to allow us to consummate our initial business combination, 
because we have not yet identified any prospective target business we cannot 
ascertain the capital requirements, if any, for any particular transaction or 
the sources of such potential financing. Such financing may not be available on
acceptable terms, if at all. The current economic environment has made it 
especially difficult for companies to obtain acquisition financing. To the 
extent additional financing proves to be unavailable when needed to consummate 
our initial business combination, we would be compelled to either restructure 
the transaction or abandon that particular initial business combination and 
seek an alternative target business candidate. 

We believe that amounts not held in trust, as well as the interest income that 
may be released to fund our working capital requirements will be sufficient to 
pay the costs and expenses to which such proceeds are allocated. This belief 
is based on the fact that while we may begin preliminary due diligence of a 
target business in connection with an indication of interest, we intend to 
undertake in-depth due diligence, depending on the circumstances of the 
relevant prospective acquisition, only after we have negotiated and signed a 
letter of intent or other preliminary agreement that addresses the terms of our
initial business combination. However, if our estimate of the costs of 
undertaking in-depth due diligence and negotiating our initial business 
combination is less than the actual amount necessary to do so, or the amount 
of interest available to use from the trust account is less than $420,000 as a 
result of the current interest rate environment, we may be required to raise 
additional capital, the amount, availability and cost of which is currently 
unascertainable. In this event, we could seek such additional capital through 
loans or additional investments from members of our management team, but such 
members of our management team are not under any obligation to advance funds 
to, or invest in, us. 

Commencing on the date that our securities are first quoted on the OTCBB, we 
have agreed to pay Galco, Inc., an affiliate of our sponsor, a total of $10,000
per month for office space, utilities and secretarial and administrative 
services. This arrangement is being agreed to by our sponsor for our benefit 
and is not intended to provide our sponsor compensation in lieu of salary or 
other remuneration. We believe that such fees are at least as favorable as we 
could have obtained from an unaffiliated person. Upon completion of our initial
business combination or our liquidation, we will cease paying these monthly 
fees. 

As of the date of this prospectus, our sponsor has advanced to us a total of 
$100,000 to be used for a portion of the expenses of this offering. These 
advances are non-interest bearing, unsecured and are due at the earlier of 
March 31, 2012 and the closing of this offering. The loan will be repaid upon 
the closing of this offering out of the $625,000 of offering proceeds that has 
been allocated to the payment of offering expenses. 

In addition, in order to finance transaction costs in connection with an 
intended initial business combination, our sponsor or an affiliate of our 
sponsor or certain of our officers and directors may, but are not obligated 
to, loan us funds as may be required. If we consummate our initial business 
combination, we would repay such loaned amounts. In the event that the initial 
business combination does not close, we may use a portion of the offering 
proceeds held outside the trust account to repay such loaned amounts but no 
proceeds from our trust account would be used to repay such loaned amounts. Up 
to $500,000 of such loans may be convertible into warrants of the post business
combination entity at a price of $0.75 per warrant at the option of the lender.
The warrants would be identical to the sponsor warrants. The terms of such 
loans by our officers and directors, if any, have not been determined and no 
written agreements exist with respect to such loans. 

Unlike many blank check companies, if we seek stockholder approval of our 
initial business combination and we do not conduct redemptions in connection 
with our business combination pursuant to the tender offer rules, prior to the 
consummation of our initial business combination, the investment management 
trust agreement to be entered into between us and Continental Stock Transfer & 
Trust Company will permit the release to us from the trust account of amounts 
necessary to purchase up to 15% of the shares sold in this offering (1,500,000 
shares, or 1,725,000 shares if the underwriters’ over-allotment option is 
exercised in full) at any time commencing after the filing of a preliminary 
proxy statement for our initial business combination and ending on the record 
date for the vote to be held to approve our initial business combination. 
Purchases will be made only in open market transactions at times when we are 
not in possession of any material non-public information and may not be made 
during a restricted period under Regulation M under the Exchange Act. It is 
intended that purchases will comply with Rule 10b-18 under the Exchange Act, 
which provides a safe harbor for purchases made under certain conditions, 
including with respect to timing, pricing and volume of purchases. If the 
conditions of Rule 10b-18, as in effect at the time we wish to make such 
purchases, are not satisfied, it is likely that we will not make such 
purchases. Any purchases we make will be at prices (inclusive of commissions) 
not to exceed the per-share amount then held in the trust account ($10.05 per 
share or approximately $10.02 per share if the underwriters’ over-allotment 
option is exercised in full). We can purchase any or all of the 1,500,000 
shares (or 1,725,000 shares if the underwriters’ over-allotment option is 
exercised in full) we are entitled to purchase. It will be entirely in our 
discretion as to how many shares are purchased. Purchasing decisions will be 
made based on various factors, including the then current market price of our 
common stock and the terms of the proposed business combination. All shares 
purchased by us will be immediately cancelled. Such open market purchases, if 
any, would be conducted by us to minimize any disparity between the then 
current market price of our common stock and the per-share amount held in the 
trust account. A market price below the per-share trust amount could provide an
incentive for purchasers to buy our shares after the filing of our preliminary 
proxy statement at a discount to the per-share amount held in the trust account
for the sole purpose of voting against our initial business combination and 
exercising redemption rights for the full per share amount held in the trust 
account. Such trading activity could enable such investors to block our initial
business combination by making it difficult for us to obtain the approval of 
such business combination by the vote of a majority of our outstanding common 
stock. 

If we seek stockholder approval of our initial business combination and we do 
not conduct redemptions in connection with our business combination pursuant to
the tender offer rules, we may enter into privately negotiated transactions to 
purchase public shares from stockholders following consummation of the initial 
business combination with proceeds released to us from the trust account 
immediately following consummation of the initial business combination. Our 
sponsor, directors, officers, advisors or their affiliates also may purchase 
shares in privately negotiated transactions either prior to or following the 
consummation of our initial business combination. Although we do not currently 
anticipate paying any premium purchase price (over the trust value) for such 
public shares, in the event we do, the payment of a premium may not be in the 
best interest of those stockholders not receiving any such premium. In 
addition, the payment of a premium by us after the consummation of our initial 
business combination may not be in the best interest of the remaining 
stockholders who do not redeem their shares. Such stockholders may experience a
reduction in book value per share compared to the value received by 
stockholders that have their shares purchased by us at a premium. Except for 
the limitations described above on use of trust proceeds released to us prior 
to consummating our initial business combination, there is no limit on the 
amount of shares that could be acquired by us or our affiliates, or the price 
we or they may pay, if we hold a stockholder vote. 

In no event will we redeem our public shares in an amount that would cause our 
net tangible assets to be less than $5,000,001. Furthermore, the redemption 
threshold may be further limited by the terms and conditions of our initial 
business combination. In such case, we would not proceed with the redemption 
of our public shares or the business combination, and instead may search for an
alternate business combination. 

A public stockholder will be entitled to receive funds from the trust account 
only upon the earlier to occur of: (i) our consummation of our initial business
combination, and then only in connection with those shares of common stock that
such stockholder properly elected to redeem, subject to the limitations 
described herein or (ii) the redemption of our public shares if we are unable 
to consummate our initial business combination within 21 months following the 
closing of this offering, subject to applicable law and as further described 
herein and any limitations (including but not limited to cash requirements) 
created by the terms of the proposed business combination. In no other 
circumstances will a public stockholder have any right or interest of any kind 
to or in the trust account. 

Our initial stockholders have agreed to waive their redemption rights with 
respect to their founder shares and public shares in connection with the 
consummation of our initial business combination. In addition, our initial 
stockholders have agreed to waive their right to liquidating distributions with
respect to their founder shares if we fail to consummate our initial business 
combination within 21 months from the closing of this offering. However, if our
sponsor, or any of our officers, directors or affiliates acquire public shares 
in or after this offering, they will be entitled to receive liquidating 
distributions with respect to such public shares if we fail to consummate our 
initial business combination within the required time period."
TUDOU HOLDINGS LTD,https://www.nasdaq.com/markets/ipos/company/tudou-holdings-ltd-840944-65618,https://www.nasdaq.com/markets/ipos/company/tudou-holdings-ltd-840944-65618,424B4,8/17/2011,https://www.nasdaq.com/markets/ipos/filing.ashx?filingid=8105831,"We will receive net proceeds from this offering of approximately US$143.5 
million after deducting the underwriting discounts and commissions and 
estimated aggregate offering expenses payable by us based upon the initial 
public offering price of US$29.00 per ADS. 

We intend to use the net proceeds we receive from this offering for the 
following purposes: 

   •     approximately US$60.0 million to fund our content procurement and 
in-house content production; 
  
   •     approximately US$30.0 million to fund our expansion of Internet 
bandwidth capacity; and 

   •     the balance to fund our working capital and for general corporate 
purposes, including potential acquisitions, partnerships, alliances and 
licensing opportunities. 
 
To the extent that the net proceeds we receive from this offering are not 
immediately applied for the above purposes, we intend to hold our net proceeds 
in short-term bank deposits or invest them in interest-bearing government 
securities. 

In utilizing the proceeds of this offering, we, as an offshore holding 
company, are permitted under PRC laws and regulations to provide funding 
to our PRC subsidiaries only through loans or capital contributions and
to other entities only through loans. Subject to satisfaction of applicable 
government registration and approval requirements, we may extend 
inter-company loans to our PRC subsidiaries or make additional capital 
contributions to our PRC subsidiaries to fund their capital expenditures or 
working capital. We cannot assure you that we will be able to obtain these 
government registrations or approvals on a timely basis, if at all. 

We will not receive any of the proceeds from the sale of the ADSs by the 
selling shareholder."
CARBONITE INC,https://www.nasdaq.com/markets/ipos/company/carbonite-inc-686680-67102,https://www.nasdaq.com/markets/ipos/company/carbonite-inc-686680-67102,424B4,8/11/2011,https://www.nasdaq.com/markets/ipos/filing.ashx?filingid=8092906,"We estimate that the net proceeds to us from the sale of the shares of common 
stock will be approximately $47.2 million, or approximately $55.9 million if 
the underwriters’ overallotment option is exercised in full, after deducting 
underwriting discounts and commissions and estimated offering expenses payable 
by us. We will not receive any proceeds from the sale of shares of common 
stock by the selling stockholders. 
  
We intend to use the net proceeds to us from this offering primarily for 
general corporate purposes, including working capital, sales and marketing 
activities, general and administrative matters, and capital expenditures. 
We may also use a portion of the net proceeds to acquire, invest in, or 
obtain rights to complementary technologies, solutions, or businesses. 
Our management will have broad discretion over the uses of the net proceeds 
in this offering. Pending these uses, we intend to invest the net proceeds 
from this offering in short-term, investment-grade, interest-bearing 
securities such as money market accounts, certificates of deposit, 
commercial paper, and guaranteed obligations of the U.S. government."
AFRICA GROWTH CORP,https://www.nasdaq.com/markets/ipos/company/africa-growth-corp-837582-65227,https://www.nasdaq.com/markets/ipos/company/africa-growth-corp-837582-65227,424B3,6/29/2011,https://www.nasdaq.com/markets/ipos/filing.ashx?filingid=8017343,"We will not receive any proceeds from the sale of Shares by selling 
shareholders."
MTGE INVESTMENT CORP.,https://www.nasdaq.com/markets/ipos/company/mtge-investment-corp-851755-66736,https://www.nasdaq.com/markets/ipos/company/mtge-investment-corp-851755-66736,424B4,8/5/2011,https://www.nasdaq.com/markets/ipos/filing.ashx?filingid=8079411,"We are offering 8,000,000 shares of our common stock at the initial public
offering price of $20.00 per share. Concurrently, we are selling to American 
Capital an aggregate of $40.0 million (or 2,000,000 shares) of our common stock 
at the initial public offering price in a private placement. The gross proceeds
from the sale of the shares sold in the concurrent private placement will not 
be subject to any underwriting discount or commissions payable by us. For all 
shares sold in this offering, including shares sold pursuant to the 
underwriters’ over-allotment option, but excluding the Reserved Shares and 
shares sold in the concurrent private placement, the underwriters will 
receive an underwriting fee of $0.80 per share payable by our Manager at 
closing or the applicable date of delivery. We estimate that the net proceeds
that we receive from this offering and the concurrent private placement will 
be approximately $199 million (or approximately $223 million if the 
underwriters exercise their over-allotment option in full), in each case 
after deducting the estimated offering expenses payable by us of approximately
$875,000.  

We intend to deploy the net proceeds from this offering and the concurrent 
private placement on a leveraged basis to invest in our targeted assets,
which include agency mortgage investments, non-agency mortgage investments
and other mortgage-related investments. 

Depending on the availability of the targeted investments, we may temporarily 
invest the net proceeds in readily marketable, short-term, interest-bearing 
investments, including money market accounts that are consistent with our 
intention to qualify as a REIT. These temporary investments are expected to
provide a lower net return than we hope to achieve from our target assets."
